2021-01-13,16.99,1.0,MT,Carhartt Men's Loose Fit Heavyweight Short-Sleeve Pocket T-Shirt,B01BXGMVI8,SHIRT,R_3lzv4o9axMfFsE2,16.99
2020-12-09,16.99,1.0,MT,Carhartt Men's Loose Fit Heavyweight Short-Sleeve Pocket T-Shirt Closeout,B01BXGMP48,SHIRT,R_3lzv4o9axMfFsE2,16.99
2021-03-10,19.99,1.0,MT,Carhartt Men's Loose Fit Heavyweight Short-Sleeve Pocket T-Shirt Closeout,B002GHC1XE,SHIRT,R_3lzv4o9axMfFsE2,19.99
2020-07-29,23.97,1.0,MT,"Columbia Men's Plus Tamiami II Long Sleeve Shirt, Riptide - Medium",B00AX723FK,SHIRT,R_1TvhpEMhVBwUasN,23.97
2022-01-20,65.0,1.0,MT,Columbia Women's Sunday Summit Ii Tunic,B0815HJ45V,SHIRT,R_2w6Kv77UCoeyLbP,65.0
2022-07-13,18.39,1.0,MT,DOROSE Womens Summer Tops Sexy V Neck Casual Ruffle Short Sleeve Shirts Blouses,B09ZNQRMHB,SHIRT,R_2w6Kv77UCoeyLbP,18.39
2022-07-21,22.99,1.0,MT,DOROSE Womens Summer Tops Sexy V Neck Casual Ruffle Short Sleeve Shirts Blouses,B09ZNS8PT6,SHIRT,R_2w6Kv77UCoeyLbP,22.99
2022-07-21,22.99,1.0,MT,DOROSE Womens Summer Tops Sexy V Neck Casual Ruffle Short Sleeve Shirts Blouses,B09ZP2M8JR,SHIRT,R_2w6Kv77UCoeyLbP,22.99
2022-07-27,22.99,1.0,MT,DOROSE Womens Summer Tops Sexy V Neck Casual Ruffle Short Sleeve Shirts Blouses,B09ZNRZY5K,SHIRT,R_2w6Kv77UCoeyLbP,22.99
2019-09-15,16.5,1.0,MT,"Daily Ritual Women's Jersey Long-Sleeve V-Neck T-Shirt, Multipacks",B079ZDW2GR,SHIRT,R_3M0euO2kPnoHrdt,16.5
2019-09-15,16.5,1.0,MT,"Daily Ritual Women's Jersey Long-Sleeve V-Neck T-Shirt, Multipacks",B079Z4SB84,SHIRT,R_3M0euO2kPnoHrdt,16.5
2019-08-15,16.5,1.0,MT,"Daily Ritual Women's Jersey Long-Sleeve V-Neck T-Shirt, Multipacks",B079Z4SB84,SHIRT,R_3M0euO2kPnoHrdt,16.5
2018-03-16,22.0,1.0,MT,"Daily Ritual Women's Jersey Long-Sleeve V-Neck T-Shirt, Multipacks",B073WZP76X,SHIRT,R_2QQl58nFfrZayxf,22.0
2021-12-03,22.99,1.0,MT,Disney The Nightmare Before Christmas Sally Queen of Screams T-Shirt,B07WX6187M,SHIRT,R_xmW6sCBJmFDlI8V,22.99
2022-06-16,23.99,1.0,MT,Dubinik® Mens Short Sleeve Button Down Shirts 100% Cotton Plaid Casual Shirt with Pocket,B09G9RF22L,SHIRT,R_2VJ7KiUFzWY3H0p,23.99
2018-03-25,6.99,1.0,MT,Flank Women Fashion Summer Casual Loose Sleeveless Vest Tank Tops (M),B01N6Y3O6W,SHIRT,R_2VJ7KiUFzWY3H0p,6.99
2022-07-03,24.99,1.0,MT,Fruit of the Loom Men's Eversoft Cotton Stay Tucked Crew T-Shirt,B08DP59T9K,SHIRT,R_2us4qPSxiD4clPq,24.99
2022-08-20,19.99,1.0,MT,Gioberti Boys Casual Plaid Checked Short Sleeve Button Down Shirt,B09VK1QZMJ,SHIRT,R_2VJ7KiUFzWY3H0p,19.99
2022-08-20,19.99,1.0,MT,Gioberti Boys Casual Plaid Checked Short Sleeve Button Down Shirt,B093Y51XRZ,SHIRT,R_2VJ7KiUFzWY3H0p,19.99
2018-11-22,9.99,1.0,MT,Gioberti Boys Casual Western Plaid Long Sleeve Pearl Snaps Shirt,B07HFFXQTF,SHIRT,R_2VJ7KiUFzWY3H0p,9.99
2018-11-22,9.99,1.0,MT,Gioberti Boys Casual Western Plaid Long Sleeve Pearl Snaps Shirt,B07HFGMGG1,SHIRT,R_2VJ7KiUFzWY3H0p,9.99
2018-11-22,9.99,1.0,MT,Gioberti Boys Casual Western Plaid Long Sleeve Pearl Snaps Shirt,B07HFFSNQL,SHIRT,R_2VJ7KiUFzWY3H0p,9.99
2018-11-22,9.99,1.0,MT,Gioberti Boys Casual Western Plaid Long Sleeve Pearl Snaps Shirt,B07HFGNLKW,SHIRT,R_2VJ7KiUFzWY3H0p,9.99
2018-11-28,19.99,1.0,MT,Gioberti Men's Western Plaid Long Sleeve Shirt with Pearl Snap-on,B07HC5Q4S2,SHIRT,R_2VJ7KiUFzWY3H0p,19.99
2018-10-12,25.0,1.0,MT,Goodthreads Men's Standard-Fit Long-Sleeve Gingham Poplin Shirt,B073VM9RL3,SHIRT,R_DtPfbKjVP7QqLVD,25.0
2018-11-12,25.0,1.0,MT,Goodthreads Men's Standard-Fit Long-Sleeve Gingham Poplin Shirt,B077442Y2R,SHIRT,R_DtPfbKjVP7QqLVD,25.0
2019-01-13,25.0,1.0,MT,Goodthreads Men's Standard-Fit Long-Sleeve Gingham Poplin Shirt,B0774LPN1C,SHIRT,R_DtPfbKjVP7QqLVD,25.0
2019-01-13,25.0,1.0,MT,Goodthreads Men's Standard-Fit Long-Sleeve Gingham Poplin Shirt,B077446ZD2,SHIRT,R_DtPfbKjVP7QqLVD,25.0
2018-03-25,19.97,1.0,MT,H2H Womens Front Pleated V-Neck Draped Long Sleeve Blouses Wine US L/Asia L (CWTTL0184),B01HRBDQ6Y,SHIRT,R_2VJ7KiUFzWY3H0p,19.97
2018-03-25,19.99,1.0,MT,JJ Perfection Women's Pleated Chiffon Layered Cami Tank Top Navy M,B019PKIT9Y,SHIRT,R_2VJ7KiUFzWY3H0p,19.99
2018-03-16,7.38,1.0,MT,JUST MY SIZE Women's Size Plus Printed Short-Sleeve V-Neck T-Shirt,B074QNJVKC,SHIRT,R_2QQl58nFfrZayxf,7.38
2022-08-24,19.97,1.0,MT,KINLONSAIR Women’s Long Sleeve Henley T Shirts Button Down Slim Fit Tops Scoop Neck Ribbed Knit Shirts,B09K5765R5,SHIRT,R_2w6Kv77UCoeyLbP,19.97
2019-12-19,16.99,1.0,MT,LUKYCILD Friends Shirt They Don't Know That We Know They Know T Shirt Women Short Sleeve Casual Letter Print Top Tee,B07WT3ZQDT,SHIRT,R_2us4qPSxiD4clPq,16.99
2022-06-16,39.33,1.0,MT,Lands' End Men's Traditional Fit Short Sleeve Seersucker Shirt,B09YBM76F7,SHIRT,R_2VJ7KiUFzWY3H0p,39.33
2022-04-13,19.99,1.0,MT,MIHOLL Women's Short Sleeve Shirt Round Neck Summer Casual Blouses Tops,B09QHRHR6Q,SHIRT,R_2w6Kv77UCoeyLbP,19.99
2022-04-13,21.99,1.0,MT,MIHOLL Women's Short Sleeve Shirt Round Neck Summer Casual Blouses Tops,B09QHSJFB1,SHIRT,R_2w6Kv77UCoeyLbP,21.99
2022-03-30,18.99,1.0,MT,Meetrendi Women's V Neck Tank Top for Summer Flowy Ribbed Camisole Loose Fit Casual Tanks,B09KGPVVCR,SHIRT,R_2w6Kv77UCoeyLbP,18.99
2020-05-31,15.99,1.0,MT,Mippo Womens Long Workout Tops Racerback Athletic Yoga Gym Tank Top Sports Tennis Shirt,B084Q8X8JN,SHIRT,R_2w6Kv77UCoeyLbP,15.99
2018-01-19,13.99,1.0,MT,"Moxeay Womens Extra Long Stretch Cotton Tank Top (X-Large, Black)",B01CNLMH22,SHIRT,R_27NeinuChlzrANs,13.99
2020-05-31,16.98,1.0,MT,Muzniuer Yoga Workout Tops for Women Backless Long Tank Workout Shirts Cover up Summer Sleeveless T Shirts,B08949VCXS,SHIRT,R_2w6Kv77UCoeyLbP,16.98
2018-08-08,22.95,1.0,MT,"PIER 17 Button Down Shirts for Women, Fitted Long Sleeve Tailored Shirt Blouse",B07D3YYYN6,SHIRT,R_27NeinuChlzrANs,22.95
2022-06-08,18.99,1.0,MT,PIIRESO Women's Summer Scoop Neck Ribbed Tank Tops Sleeveless Henley Button Down Casual Shirts,B09Y1WS9MV,SHIRT,R_2w6Kv77UCoeyLbP,18.99
2018-12-03,17.55,1.0,MT,Popfunk Harry Potter Dumbledore Happiness Quote T Shirt & Stickers,B06XRMZ9XP,SHIRT,R_2VJ7KiUFzWY3H0p,17.55
2018-12-03,17.99,1.0,MT,Popfunk Harry Potter Hogwarts Houses Distressed T Shirt & Stickers,B06XP7L5YH,SHIRT,R_2VJ7KiUFzWY3H0p,17.99
2022-01-14,23.95,1.0,MT,Ripple Junction Doctor WHO Linear Tardis Adult T-Shirt,B00DW8DSME,SHIRT,R_3lzv4o9axMfFsE2,23.95
2022-04-02,28.89,1.0,MT,Scarlet Darkness Women Victorian Short Sleeve Shirt Steampunk Lace Up Blouse,B08R3JTQT1,SHIRT,R_2w6Kv77UCoeyLbP,28.89
2022-08-20,16.99,1.0,MT,Spring&Gege Boys' Casual Short Sleeve Button Down Shirts Cotton Plaid,B088JW6N1P,SHIRT,R_2VJ7KiUFzWY3H0p,16.99
2022-08-20,16.99,1.0,MT,Spring&Gege Boys' Casual Short Sleeve Button Down Shirts Cotton Plaid,B09PNJZX1F,SHIRT,R_2VJ7KiUFzWY3H0p,16.99
2022-08-20,16.99,1.0,MT,Stylore Men's Hawaiian Shirt Button Down Short Sleeves Flamingo,B08LDNPFW2,SHIRT,R_2VJ7KiUFzWY3H0p,16.99
2022-06-11,9.99,1.0,MT,SweatyRocks Women's 2 Pack Long Sleeve Crop Top Turtleneck Slim Fit Tee Shirt Black White L,B09CK5CM2R,SHIRT,R_1TvhpEMhVBwUasN,9.99
2022-07-13,18.99,1.0,MT,VICHYIE Women Tank Tops Summer Sleeveless Basic Cami Top Shirt Slim Knit Ribbed Racerback Blouses,B0B14GM2JV,SHIRT,R_2w6Kv77UCoeyLbP,18.99
2022-07-13,18.99,1.0,MT,VICHYIE Women Tank Tops Summer Sleeveless Basic Cami Top Shirt Slim Knit Ribbed Racerback Blouses,B087F13C14,SHIRT,R_2w6Kv77UCoeyLbP,18.99
2018-01-19,17.99,1.0,MT,"Voguegirl Women Career Fitted Lace Tops Ruffle High Neck Long Sleeve Shirt Blouse (XXL, White)",B01L6TFV6G,SHIRT,R_27NeinuChlzrANs,17.99
2021-06-07,15.29,1.0,MT,WIHOLL Womens Tops V Neck Summer Petal Sleeve Casual Tshirts,B092S7ZV49,SHIRT,R_2w6Kv77UCoeyLbP,15.29
2021-06-07,15.29,1.0,MT,WIHOLL Womens Tops V Neck Summer Petal Sleeve Casual Tshirts,B08ZJ9K7RT,SHIRT,R_2w6Kv77UCoeyLbP,15.29
2021-06-07,15.29,1.0,MT,WIHOLL Womens Tops V Neck Summer Petal Sleeve Casual Tshirts,B08S3H1X62,SHIRT,R_2w6Kv77UCoeyLbP,15.29
2021-06-03,17.99,1.0,MT,WIHOLL Womens Tops V Neck Summer Petal Sleeve Casual Tshirts,B08S3G721T,SHIRT,R_2w6Kv77UCoeyLbP,17.99
2022-06-17,23.78,1.0,MT,Womens Ruffle Short Sleeve Shirts Slim Fit High Neck Knit Ribbed Tops,B09JC87ZCL,SHIRT,R_2w6Kv77UCoeyLbP,23.78
2022-05-26,28.98,1.0,MT,Womens Ruffle Short Sleeve Shirts Slim Fit High Neck Knit Ribbed Tops,B09JC7TYNQ,SHIRT,R_2w6Kv77UCoeyLbP,28.98
2022-04-27,31.95,1.0,MT,Xelky 4-5 Pack Men's Dry Fit T Shirt Moisture Wicking Athletic Tees Exercise Fitness Activewear Short Sleeves Gym Workout Top,B098Q69R51,SHIRT,R_2QQl58nFfrZayxf,31.95
2018-03-25,30.49,1.0,MT,"Zeagoo Women Comfy Sexy Crossover Front Wrap Drape Long Sleeve Club Wear Blouse Top, Wine Red, Large",B075ZPR5BQ,SHIRT,R_2VJ7KiUFzWY3H0p,30.49
2021-08-29,18.52,1.0,MT,Zecilbo Women's Racerback Workout Ribbed Tank Tops Round Neck Sleeveless Basic Tops,B0881764TM,SHIRT,R_2w6Kv77UCoeyLbP,18.52
2019-08-15,11.24,1.0,MT,adidas Boy's Entrada 18 Jersey,B071GWKYLP,SHIRT,R_3M0euO2kPnoHrdt,11.24
2020-10-05,3.99,1.0,MT,"BIRCH's Round Shoelaces 27 Colors 3/16"" Thick Shoe Laces 4 Different Lengths …",B071ZFXFST,SHOELACE,R_2w6Kv77UCoeyLbP,3.99
2020-10-05,5.99,1.0,MT,"BIRCH's Round Shoelaces 27 Colors 3/16"" Thick Shoe Laces 4 Different Lengths …",B072FPC9KW,SHOELACE,R_2w6Kv77UCoeyLbP,5.99
2020-10-14,6.71,1.0,MT,"DELELE 2Pair Oval Shoes laces 42 Colors Half Round 1/4"" Athletic ShoeLaces for Sport/Running Shoes Shoe Strings",B07XZ2T8CV,SHOELACE,R_2w6Kv77UCoeyLbP,6.71
2020-10-14,6.71,1.0,MT,"DELELE 2Pair Oval Shoes laces 42 Colors Half Round 1/4"" Athletic ShoeLaces for Sport/Running Shoes Shoe Strings",B07XZ2T8CX,SHOELACE,R_2w6Kv77UCoeyLbP,6.71
2020-10-14,6.71,1.0,MT,"DELELE 2Pair Oval Shoes laces 42 Colors Half Round 1/4"" Athletic ShoeLaces for Sport/Running Shoes Shoe Strings",B07XZ2FFS1,SHOELACE,R_2w6Kv77UCoeyLbP,6.71
2020-10-14,7.19,1.0,MT,"DELELE 2Pair Oval Shoes laces 42 Colors Half Round 1/4"" Athletic ShoeLaces for Sport/Running Shoes Shoe Strings",B07XYZT49H,SHOELACE,R_2w6Kv77UCoeyLbP,7.19
2020-10-14,8.39,1.0,MT,"DELELE 2Pair Oval Shoes laces 42 Colors Half Round 1/4"" Athletic ShoeLaces for Sport/Running Shoes Shoe Strings",B07XZ2NL7C,SHOELACE,R_2w6Kv77UCoeyLbP,8.39
2019-10-12,59.95,1.0,MT,ASICS Women's GEL-Venture 5 Running Shoe,B00NUY4H0W,SHOES,R_3M0euO2kPnoHrdt,59.95
2019-10-12,49.9,1.0,MT,ASICS Women's Gel-Venture 6 Running Shoe,B07D7PF8Z3,SHOES,R_3M0euO2kPnoHrdt,49.9
2022-02-18,58.99,1.0,MT,Ballroom Dance Shoes Women Latin Salsa Practice Dancer Shoes 2.5'' Heels YT02,B07FLYCGKN,SHOES,R_2VJ7KiUFzWY3H0p,58.99
2020-07-07,25.87,1.0,MT,CIOR Boys & Girls Water Shoes Quick Drying Sports Aqua Athletic Sneakers Lightweight Sport Shoes(Toddler/Little Kid/Big Kid) U1ELJSX012-Blk.orange-34,B081Z1DCQ5,SHOES,R_2VJ7KiUFzWY3H0p,25.87
2020-07-21,25.87,1.0,MT,CIOR Boys & Girls Water Shoes Sports Aqua Athletic Sneakers Lightweight Sport Shoes(Toddler/Little Kid/Big Kid) U1ELJSX011-Blk.blue-36,B07VPB99KS,SHOES,R_2VJ7KiUFzWY3H0p,25.87
2019-07-30,19.99,1.0,MT,Champion Slate Boys' Powerstrap Gusto Runner 1 Regular,B07DY5Y6CQ,SHOES,R_3M0euO2kPnoHrdt,19.99
2019-11-24,32.83,1.0,MT,"Crocs Star Wars Empire Band Character Clog, Black, 1 M US Little Kid",B07L13VHZ8,SHOES,R_3M0euO2kPnoHrdt,32.83
2021-06-16,65.0,1.0,MT,DC Men's Net Casual Low Top Lace Up Skate Shoe Sneaker,B00ANLFH68,SHOES,R_1TvhpEMhVBwUasN,65.0
2018-05-29,77.99,1.0,MT,Dansko Women's Dorothy Dress Pump,B01N4IU6PO,SHOES,R_2w6Kv77UCoeyLbP,77.99
2020-09-27,6.82,1.0,MT,"Fiebing's Shoe Stretch-It, 4 Oz. - for Leather, Suede, or Nubuck Shoes",B000TZ8TEU,SHOES,R_2w6Kv77UCoeyLbP,6.82
2021-03-14,67.45,1.0,MT,HEAD Women's Revolt Pro 3.0 Tennis Shoe,B084GQ16D5,SHOES,R_2w6Kv77UCoeyLbP,67.45
2019-01-13,41.99,1.0,MT,Jousen Mens Fashion Breathable Sneakers Shoes Casual Business Shoes for Men,B07DGV5C2B,SHOES,R_DtPfbKjVP7QqLVD,41.99
2020-07-23,55.11,1.0,MT,KEEN Unisex-Child Targhee Low Hiking Shoe,B077YNCG78,SHOES,R_3M0euO2kPnoHrdt,55.11
2020-07-21,20.35,1.0,MT,MAYZERO Water Shoes Swim Surf Shoes Beach Pool Shoes Wide Toe Hiking Water Sneakers Quick Dry Aqua Shoes for Men and Women,B083ZF1PW1,SHOES,R_2VJ7KiUFzWY3H0p,20.35
2019-07-30,36.97,2.0,MT,New Balance Kid's 680 V5 Alternative Closure Running Shoe,B07BQV74Y1,SHOES,R_3M0euO2kPnoHrdt,73.94
2018-04-26,41.83,1.0,MT,Nike Boys Huarache 2KFilth Pro (GS) Baseball Cleat,B00V996DFM,SHOES,R_2VJ7KiUFzWY3H0p,41.83
2019-07-12,43.99,1.0,MT,PUMA Men's Ignite Flash Evoknit Sneaker,B0721KGS9G,SHOES,R_2QQl58nFfrZayxf,43.99
2022-07-26,64.66,1.0,MT,PUMA Women's Laguna Fusion Sport Golf Shoe,B07SMKMXM4,SHOES,R_2w6Kv77UCoeyLbP,64.66
2019-01-13,65.0,1.0,MT,Polo Ralph Lauren Men's Halmore Canvas Fashion Sneaker,B017YO83YY,SHOES,R_DtPfbKjVP7QqLVD,65.0
2021-11-17,32.99,1.0,MT,SITAILE Water Shoes Men Women Quick Dry Barefoot Aqua Swim River Shoes for Pool Beach Hiking Walking Shoes,B07DBYNBYK,SHOES,R_2VJ7KiUFzWY3H0p,32.99
2021-11-17,32.99,1.0,MT,SITAILE Water Shoes Men Women Quick Dry Barefoot Aqua Swim River Shoes for Pool Beach Hiking Walking Shoes,B07DBY3YS5,SHOES,R_2VJ7KiUFzWY3H0p,32.99
2021-11-17,32.99,1.0,MT,SITAILE Water Shoes Men Women Quick Dry Barefoot Aqua Swim River Shoes for Pool Beach Hiking Walking Shoes,B07RYLJW3D,SHOES,R_2VJ7KiUFzWY3H0p,32.99
2021-11-17,32.99,1.0,MT,SITAILE Water Shoes Men Women Quick Dry Barefoot Aqua Swim River Shoes for Pool Beach Hiking Walking Shoes,B07LGXV1ZN,SHOES,R_2VJ7KiUFzWY3H0p,32.99
2021-11-17,35.99,1.0,MT,SOBASO Water Shoes Women Men Quick Drying Swim Beach Aqua Shoes for Water Sport Diving Hiking Sailing Travel,B083ZWYYZC,SHOES,R_2VJ7KiUFzWY3H0p,35.99
2021-11-17,35.99,1.0,MT,SOBASO Water Shoes Women Men Quick Drying Swim Beach Aqua Shoes for Water Sport Diving Hiking Sailing Travel,B083ZXY8Q1,SHOES,R_2VJ7KiUFzWY3H0p,35.99
2021-11-17,35.99,1.0,MT,SOBASO Water Shoes Women Men Quick Drying Swim Beach Aqua Shoes for Water Sport Diving Hiking Sailing Travel,B09JFK8LQD,SHOES,R_2VJ7KiUFzWY3H0p,35.99
2021-11-17,35.99,1.0,MT,SOBASO Water Shoes Women Men Quick Drying Swim Beach Aqua Shoes for Water Sport Diving Hiking Sailing Travel,B09JG11DH3,SHOES,R_2VJ7KiUFzWY3H0p,35.99
2018-04-26,12.99,1.0,MT,Shoes8teen Womens Ballerina Ballet Flats Shoes Leopard & Solids 14 Colors,B071J2KG3R,SHOES,R_27NeinuChlzrANs,12.99
2018-05-15,41.96,1.0,MT,Skechers Men's Afterburn M. Fit Wonted Loafer,B075PG1YCV,SHOES,R_2QQl58nFfrZayxf,41.96
2020-04-24,44.95,1.0,MT,Skechers Men's Alley Cat Utility Shoe,B002FFWE6G,SHOES,R_3M0euO2kPnoHrdt,44.95
2022-04-27,44.98,1.0,MT,Skechers Men's Go Max-Athletic Air Mesh Slip on Walking Shoe Sneaker,B08DZYRVWQ,SHOES,R_2QQl58nFfrZayxf,44.98
2022-02-13,29.99,2.0,MT,"Sloggers Men's Premium Garden Clog , Black, Size 11, Style 261BK11",B000QGZHO2,SHOES,R_2VJ7KiUFzWY3H0p,59.98
2019-10-12,92.79,1.0,MT,Sorel Women's Snow Angel Lace Boot,B000S6Q334,SHOES,R_3M0euO2kPnoHrdt,92.79
2018-03-12,35.91,1.0,MT,Steve Madden Men's Fenta Fashion Sneaker,B01LW07OEQ,SHOES,R_DtPfbKjVP7QqLVD,35.91
2020-02-20,34.99,1.0,MT,UOVO Boys Shoes Tennis Running Waterproof Hiking Sneakers Kids Athletic Outdoor Slip Resistant Little/Big,B081PTYP62,SHOES,R_2VJ7KiUFzWY3H0p,34.99
2020-02-20,34.99,1.0,MT,UOVO Boys Shoes Tennis Running Waterproof Hiking Sneakers Kids Athletic Outdoor Slip Resistant Little/Big,B081PTYP62,SHOES,R_2VJ7KiUFzWY3H0p,34.99
2020-06-25,13.88,1.0,MT,WateLves Womens and Mens Kids Water Shoes Barefoot Quick-Dry Aqua Socks for Beach Swim Surf Yoga Exercise,B07QMKLXS6,SHOES,R_1gwL8QZGzhV0g3G,13.88
2021-12-02,27.99,1.0,MT,"Water Shoes for Men Barefoot Quick-Dry Aqua Sock Outdoor Athletic Sport Shoes for Kayaking, Boating, Hiking, Surfing, Walking",B083F9X3FV,SHOES,R_2VJ7KiUFzWY3H0p,27.99
2021-12-02,28.88,1.0,MT,"Water Shoes for Men Barefoot Quick-Dry Aqua Sock Outdoor Athletic Sport Shoes for Kayaking, Boating, Hiking, Surfing, Walking",B07MC63S7F,SHOES,R_2VJ7KiUFzWY3H0p,28.88
2021-12-02,29.88,1.0,MT,"Water Shoes for Men Barefoot Quick-Dry Aqua Sock Outdoor Athletic Sport Shoes for Kayaking, Boating, Hiking, Surfing, Walking",B087RDLPSW,SHOES,R_2VJ7KiUFzWY3H0p,29.88
2021-12-02,29.88,1.0,MT,"Water Shoes for Men Barefoot Quick-Dry Aqua Sock Outdoor Athletic Sport Shoes for Kayaking, Boating, Hiking, Surfing, Walking",B087RF9KFK,SHOES,R_2VJ7KiUFzWY3H0p,29.88
2019-08-15,28.0,1.0,MT,adidas Copa 19.3 Fg J Black/Solar Yellow Soccer Shoes (D98080),B07CZ2M499,SHOES,R_3M0euO2kPnoHrdt,28.0
2021-11-13,18.99,1.0,MT,"beister Mens Clogs Non Slip Water Shoes with Adjustable Strap, Lightweight Slip on Mules Garden Kitchen Outdoor Beach Yard Pool Shower Summer Sandals Slippers",B089DBMZBT,SHOES,R_2VJ7KiUFzWY3H0p,18.99
2020-01-29,7.97,2.0,MT,"FootMatters Professional Boot & Shoe Stretch Spray – Softener & Stretcher for Leather, Suede, Nubuck, Canvas – 4 oz",B00NLM8EL6,SHOE_ACCESSORY,R_2w6Kv77UCoeyLbP,15.94
2022-01-05,6.94,1.0,MT,KIWI Boot Water proofer - Tough Silicone Waterproof Spray for Boot,B01LXP7UTU,SHOE_ACCESSORY,R_1gwL8QZGzhV0g3G,6.94
2020-12-31,12.75,1.0,MT,"Velette 16.5"" Long Metal Shoe Horn - Shoe Horns for Seniors, Men, Women and Kids - Shoehorn Helper for Boots and Shoes",B07C412KYF,SHOE_ACCESSORY,R_2w6Kv77UCoeyLbP,12.75
2021-04-13,5.88,3.0,MT,Dr. Scholl's Ball of Foot Cushions for High Heels (One Size) // Relieve and Prevent Ball of Foot Pain with Discreet Cushions That Absorb Shock and Make High Heels More Comfortable,B0862RD2NQ,SHOE_INSERT,R_2w6Kv77UCoeyLbP,17.64
2022-06-08,9.29,1.0,MT,"Dr. Scholl's Soft Cushioning Insoles for Sneakers, Superior Shock Absorption and Cushioning (Women's Size 6-10), 1 Count",B08644FS8T,SHOE_INSERT,R_1TvhpEMhVBwUasN,9.29
2020-09-26,17.88,1.0,MT,"XTRATUF Bama Sokket Insulating Removable Men's Boot Liners (28500), 12",B0002EEROY,SHOE_INSERT,R_1TvhpEMhVBwUasN,17.88
2021-03-18,11.99,1.0,MT,"ZenToes Metatarsal Pads for Women and Men - 2 Pairs Ball of Foot Cushions (Small, Beige)",B0716J6G8X,SHOE_INSERT,R_2w6Kv77UCoeyLbP,11.99
2020-01-28,209.95,1.0,MT,"FootFitter Professional Cast Aluminum Combination Boot Instep & Shaft Stretcher, Relieves Boot Tightness on Ankle & Calf",B000PON49U,SHOE_TREE,R_2w6Kv77UCoeyLbP,209.95
2020-09-27,12.95,1.0,MT,"FootFitter Professional Shoe & Boot Stretch Spray - Stretching Spray for Leather, Suede & Nubuck Footwear - MADE IN USA",B000POL22G,SHOE_TREE,R_2w6Kv77UCoeyLbP,12.95
2018-12-03,7.95,1.0,MT,A4 Sportswear mens womens Athletic Shorts,B01MPXKUMQ,SHORTS,R_2VJ7KiUFzWY3H0p,7.95
2022-06-08,14.44,1.0,MT,GAYHAY 3 Pack Biker Shorts for Women – 5” High Waisted Tummy Control Soft Workout Shorts for Yoga Athletic Running Cycling,B091Y3N6K9,SHORTS,R_1TvhpEMhVBwUasN,14.44
2018-05-20,6.0,1.0,MT,"Hanes Women's Stretch Jersey Bike Shorts, Women’s Cotton Bike Shorts, Women’s Athletic Shorts, 7"" Inseam",B01I21EKN6,SHORTS,R_27NeinuChlzrANs,6.0
2018-05-20,14.99,1.0,MT,Liang Rou Women's Ultra Thin Stretch Short Leggings,B074QPNLC7,SHORTS,R_27NeinuChlzrANs,14.99
2021-10-23,20.99,1.0,MT,Nonwe Men's Beachwear Summer Holiday Swim Trunks Quick Dry Striped,B0732PTXKH,SHORTS,R_2VJ7KiUFzWY3H0p,20.99
2022-07-12,23.99,1.0,MT,THE GYM PEOPLE Womens High Waisted Running Shorts Quick Dry Athletic Workout Shorts with Mesh Liner Zipper Pockets,B09SG99223,SHORTS,R_2w6Kv77UCoeyLbP,23.99
2021-06-14,22.99,2.0,MT,"Youper Elite Compression Padded Softball Sliding Shorts, Womens Sizes",B083XBS4F3,SHORTS,R_2VJ7KiUFzWY3H0p,45.98
2019-08-15,12.92,1.0,MT,adidas Boy's Tastigo 19 Shorts,B07DXNJMC6,SHORTS,R_3M0euO2kPnoHrdt,12.92
2020-07-30,20.43,1.0,MT,"HO2ME High Pressure Handheld Shower Head with Powerful Shower Spray against Low Pressure Water Supply Pipeline, Multi-functions, w/ 79 inch Hose, Bracket, Flow Regulator, Chrome Finish",B015MMA1Q8,SHOWERHEAD,R_1gwL8QZGzhV0g3G,20.43
2020-02-08,0.99,1.0,MT,Tracfone Prepaid Sim Card Kit (Universal),B0728N8PT9,SIM_CARD,R_1TvhpEMhVBwUasN,0.99
2021-07-10,5.99,1.0,MT,"Blackhead Remover, 2 PCS Pimple Popper Tool，Stainless Steel Pimple Extractor Blackhead Removal Tool Risk Free Treatment for Blemish,Whitehead Popping,Blemish",B08HLRDJMY,SKIN_BLEMISH_REMOVAL_TOOL,R_2w6Kv77UCoeyLbP,5.99
2019-08-20,6.99,1.0,MT,"JPNK Blackhead Remover Tool Comedones Extractor Acne Removal Kit for Blemish, Whitehead Popping, 6 Pcs Zit Removing for Nose Face Tools with a Leather Bag",B01CNMASFY,SKIN_BLEMISH_REMOVAL_TOOL,R_27NeinuChlzrANs,6.99
2020-07-16,6.99,1.0,MT,Beesworks® (6) 1oz Yellow Beeswax Bars - Package of (6) 1oz Bars (6oz) - Cosmetic Grade,B01LWX2IO1,SKIN_CLEANING_AGENT,R_3lzv4o9axMfFsE2,6.99
2019-09-15,28.0,1.0,MT,"DHC Deep Cleansing Oil, Facial Cleansing Oil, Makeup Remover, Cleanses without Clogging Pores, Residue-Free, Fragrance and Colorant Free, All Skin Types, 6.7 fl. oz.",B001UE60E0,SKIN_CLEANING_AGENT,R_3M0euO2kPnoHrdt,28.0
2019-09-15,15.99,1.0,MT,"DHC Mild Soap, Honey, 3.1 Oz",B003V89YD2,SKIN_CLEANING_AGENT,R_3M0euO2kPnoHrdt,15.99
2021-06-01,14.99,1.0,MT,"Dove Deep Moisture Body Wash For Dry Skin Moisturizing Body Wash Transforms Even The Driest Skin In One Shower , 22 Fl Oz (Pack of 4)",B0846G318P,SKIN_CLEANING_AGENT,R_1TvhpEMhVBwUasN,14.99
2020-09-30,18.92,2.0,MT,"Dove Deep Moisture Body Wash For Dry Skin Moisturizing Body Wash Transforms Even The Driest Skin In One Shower , 22 Fl Oz (Pack of 4)",B0846G318P,SKIN_CLEANING_AGENT,R_1TvhpEMhVBwUasN,37.84
2021-05-19,8.8,1.0,MT,"Garnier SkinActive Face Wash with Green Tea, Oily Skin, 6.7 fl. oz.",B073QPB8HY,SKIN_CLEANING_AGENT,R_1TvhpEMhVBwUasN,8.8
2021-02-20,9.79,1.0,MT,"Garnier SkinActive Face Wash with Green Tea, Oily Skin, 6.7 fl. oz.",B073QPB8HY,SKIN_CLEANING_AGENT,R_1TvhpEMhVBwUasN,9.79
2020-02-15,19.97,1.0,MT,"InstaNatural Vitamin C Face Wash, Anti Aging Face Wash and Exfoliating Face Wash with Aloe Vera and Green Tea Extract, Vitamin C Cleanser",B00VMYKCL0,SKIN_CLEANING_AGENT,R_3M0euO2kPnoHrdt,19.97
2022-01-17,12.0,1.0,MT,Irish Spring Original Body Wash for Men - 18 Fl Oz (Pack of 4),B079QCV5KN,SKIN_CLEANING_AGENT,R_1TvhpEMhVBwUasN,12.0
2022-05-06,9.19,1.0,MT,"J.R. Watkins Gel Hand Soap Refill Pouch, Scented Liquid Hand Wash for Bathroom or Kitchen, USA Made and Cruelty Free, 34 fl oz, Aloe & Green Tea, 6 Pack",B0744KCLFQ,SKIN_CLEANING_AGENT,R_1TvhpEMhVBwUasN,9.19
2021-03-17,6.99,1.0,MT,"NIVEA Cocoa and Shea Butter Pampering Body Wash with Nourishing Serum, 20 Fl Oz Bottle",B082QBM463,SKIN_CLEANING_AGENT,R_1TvhpEMhVBwUasN,6.99
2019-03-02,11.97,1.0,MT,"NIVEA MEN Maximum Hydration Body Wash, Aloe Vera Body Wash for Dry Skin, 16.9 Fl Oz (Pack of 3)",B00OQ1ZKO0,SKIN_CLEANING_AGENT,R_1TvhpEMhVBwUasN,11.97
2018-05-15,29.94,1.0,MT,"Old Spice Classic Scent, 18 Ounce",B001LF4BB2,SKIN_CLEANING_AGENT,R_2QQl58nFfrZayxf,29.94
2020-05-31,12.98,1.0,MT,"Vagisil Odor Block Daily Intimate Feminine Wash for Women, Gynecologist Tested, Hypoallergenic, 12 Ounce- Pack of 3 (Packaging May Vary)",B085WGSMX2,SKIN_CLEANING_AGENT,R_2w6Kv77UCoeyLbP,12.98
2020-04-07,19.65,1.0,MT,"Baby Wipes Unscented by Boogie Wipes, Wet Wipes for Face, Hand, Body & Nose, Made with Vitamin E, Aloe, Chamomile and Natural Saline, 180 Count",B017GYO3I2,SKIN_CLEANING_WIPE,R_2w6Kv77UCoeyLbP,19.65
2019-10-22,13.98,1.0,MT,"Huggies Natural Care Sensitive Baby Wipes, Unscented, 48 Count (Pack of 6)",B07M6XVCBY,SKIN_CLEANING_WIPE,R_1TvhpEMhVBwUasN,13.98
2019-11-15,13.98,1.0,MT,"Huggies Natural Care Sensitive Baby Wipes, Unscented, 48 Count (Pack of 6)",B07M6XVCBY,SKIN_CLEANING_WIPE,R_1TvhpEMhVBwUasN,13.98
2020-05-28,8.97,1.0,MT,"Neutrogena Makeup Remover Cleansing Face Wipes, Daily Cleansing Facial Towelettes Remove Makeup & Waterproof Mascara, Alcohol-Free, 100% Plant-Based Fibers, Value Twin Pack, 25 count, 2 pk",B00U2VQZDS,SKIN_CLEANING_WIPE,R_2w6Kv77UCoeyLbP,8.97
2019-10-13,3.62,1.0,MT,"Wet Ones Antibacterial Hand Wipes, Fresh Scent, 48 Individually Wrapped Wipes in a Dispenser, Packaging May Vary",B075SCGWBF,SKIN_CLEANING_WIPE,R_1TvhpEMhVBwUasN,3.62
2020-01-04,3.62,1.0,MT,"Wet Ones Antibacterial Hand Wipes, Fresh Scent, 48 Individually Wrapped Wipes in a Dispenser, Packaging May Vary",B075SCGWBF,SKIN_CLEANING_WIPE,R_1TvhpEMhVBwUasN,3.62
2019-10-29,11.49,1.0,MT,Vivo Per Lei Facial Peeling Gel - Contains Dead Sea Minerals and Nut Shell Powder - Gentle Face Exfoliator Scrub and Blackhead Remover - Peel Your Skin to a Fresher You - 3.4 Fl. Oz.,B003SSTL42,SKIN_EXFOLIANT,R_2AHiSANbVno9jis,11.49
2019-07-16,11.44,1.0,MT,"ADFORS DIY Screen Frame Kit, 5/16"" x 4', White",B000VYIWLE,SKIN_MOISTURIZER,R_3M0euO2kPnoHrdt,11.44
2022-03-05,7.66,1.0,MT,"Burt's Bees Hand Cream, (Package May Vary) Honey & Grapeseed Oil 2.6 Ounce",B0013L3NKY,SKIN_MOISTURIZER,R_3lzv4o9axMfFsE2,7.66
2022-10-30,21.98,1.0,MT,"Curel Hydra Therapy In Shower Lotion, Itch Defense Body Moisturizer with Advanced Ceramide Complex, Vitamin E, & Oatmeal Extract, Helps to Repair Moisture Barrier, 12 Ounce (Pack of 2)",B097F2VN4C,SKIN_MOISTURIZER,R_1TvhpEMhVBwUasN,21.98
2021-11-30,9.97,2.0,MT,"Curél Hydra Therapy, Itch Defense Moisturizer, Wet Skin Lotion, 12 Ounce, with Advanced Ceramide Complex, Vitamin E, & Oatmeal Extract, Helps to Repair Moisture Barrier",B07DQX9B7G,SKIN_MOISTURIZER,R_1TvhpEMhVBwUasN,19.94
2021-05-19,9.99,3.0,MT,"Curél Hydra Therapy, Itch Defense Moisturizer, Wet Skin Lotion, 12 Ounce, with Advanced Ceramide Complex, Vitamin E, & Oatmeal Extract, Helps to Repair Moisture Barrier",B07DQX9B7G,SKIN_MOISTURIZER,R_1TvhpEMhVBwUasN,29.97
2019-11-24,9.99,2.0,MT,"Curél Hydra Therapy, Itch Defense Moisturizer, Wet Skin Lotion, 12 Ounce, with Advanced Ceramide Complex, Vitamin E, & Oatmeal Extract, Helps to Repair Moisture Barrier",B07DQX9B7G,SKIN_MOISTURIZER,R_1TvhpEMhVBwUasN,19.98
2021-02-22,10.49,2.0,MT,"Curél Hydra Therapy, Itch Defense Moisturizer, Wet Skin Lotion, 12 Ounce, with Advanced Ceramide Complex, Vitamin E, & Oatmeal Extract, Helps to Repair Moisture Barrier",B07DQX9B7G,SKIN_MOISTURIZER,R_1TvhpEMhVBwUasN,20.98
2020-09-30,10.49,1.0,MT,"Curél Hydra Therapy, Itch Defense Moisturizer, Wet Skin Lotion, 12 Ounce, with Advanced Ceramide Complex, Vitamin E, & Oatmeal Extract, Helps to Repair Moisture Barrier",B07DQX9B7G,SKIN_MOISTURIZER,R_1TvhpEMhVBwUasN,10.49
2020-07-10,10.49,1.0,MT,"Curél Hydra Therapy, Itch Defense Moisturizer, Wet Skin Lotion, 12 Ounce, with Advanced Ceramide Complex, Vitamin E, & Oatmeal Extract, Helps to Repair Moisture Barrier",B07DQX9B7G,SKIN_MOISTURIZER,R_1TvhpEMhVBwUasN,10.49
