2021-02-13,12.88,1.0,MT,"MacyHS Pet Hair Remover Brush - Fur & Lint Removal Brush with Self-Cleaning Base - Dog & Cat Hair Remover for Furniture, Carpet, Bed, Car Seat, Clothing - Animal Fur & Dust Removal Tool(Gray",B07MMLNLWJ,LINT_REMOVER,R_2w6Kv77UCoeyLbP,12.88
2018-06-24,8.97,1.0,MT,"Beessential All Natural Lip Balm, Lemon Lavender, 3 Pack | For Dry and Chapped Lips, Great For Men, Women, and Children, Moisturizing Beeswax, Coconut, Shea and Cupuacu Butter",B012QE1KDS,LIP_BALM,R_27NeinuChlzrANs,8.97
2022-11-05,3.99,1.0,MT,"Lip Smacker Lippy Pal Unicorn Flavored Lip Balm | Clear Matte | Unicorn Magic | For Kids, Girls | Stocking Stuffer | Christmas Gift",B077XC7K7V,LIP_BALM,R_3lzv4o9axMfFsE2,3.99
2022-11-05,2.0,1.0,MT,Lip Smacker Unicorn Hand Sanitizer,B09N7YT329,LIP_BALM,R_3lzv4o9axMfFsE2,2.0
2021-11-10,2.88,1.0,MT,"Palmer's Coconut Oil Formula Lip Balm Duo with SPF 15 and Vitamin E, All-Day Moisturizing Sunscreen Lip Balm, Hydrates Dry, Cracked Lips (Pack of 2)",B07MBHRYTJ,LIP_BALM,R_1gwL8QZGzhV0g3G,2.88
2021-02-18,2.99,2.0,MT,"eos 100% Natural Lip Balm- Vanilla Mint, All-Day Moisture, Made for Sensitive Skin, Lip Care Products, 0.25 oz",B01KA6ZDVO,LIP_BALM,R_1gwL8QZGzhV0g3G,5.98
2022-06-02,15.0,1.0,MT,ETUDE Dear Darling Water Tint 3 Color SET 9.5g x 3color (21AD) | Vivid Color Lip Stain with Moisturizing Weightless & Non-sticky Finish Lip Stain | Smudge-proof & Lightweight Lip Tint | K-beauty,B099RTBWKR,LIP_COLOR,R_27NeinuChlzrANs,15.0
2021-08-24,5.99,1.0,MT,NYX PROFESSIONAL MAKEUP Matte Lipstick - Euro Trash (Dark Pink Brown),B005FYJF3E,LIP_COLOR,R_2w6Kv77UCoeyLbP,5.99
2020-01-03,7.32,1.0,MT,"Speedball Super Black India Ink, 2-Ounce",B0007ZJ8TM,LIQUID_INK,R_27NeinuChlzrANs,7.32
2022-11-09,42.89,2.0,MT,Amazon Basics No-Mess Hooded Cat Litter Box (Various Sizes),B0752V2ZD7,LITTER_BOX,R_2VJ7KiUFzWY3H0p,85.78
2020-08-06,49.95,1.0,MT,PetSafe ScoopFree Reusable Tray for Cat Litter Boxes - Includes 4.3 lb of Premium Blue Non Clumping Crystal Litter - Compatible with All PetSafe ScoopFree Automatic Self Cleaning Litter Boxes,B01J5GE3GQ,LITTER_BOX,R_2VJ7KiUFzWY3H0p,49.95
2019-06-02,4.59,1.0,MT,"Petmate Open Cat Litter Box, Large Nonstick Litter Pan Durable Standard Litter Box, Mouse Grey Great for Small & Large Cats Easy to Clean & USA Made",B00JOZ444U,LITTER_BOX,R_27NeinuChlzrANs,4.59
2019-11-28,8.99,3.0,MT,"Van Ness Pets Odor Control Large Enclosed Cat Litter Box, Hooded, Pearl, CP6",B0002ASCGC,LITTER_BOX,R_2VJ7KiUFzWY3H0p,26.97
2022-05-04,29.95,1.0,MT,"Bike U Lock,20mm Heavy Duty Combination Bicycle D Lock Shackle 4ft Length Security Cable with Sturdy Mounting Bracket and Key Anti Theft Bicycle Secure Locks",B08KCWFMRS,LOCK,R_2QQl58nFfrZayxf,29.95
2022-06-11,8.74,1.0,MT,"Master Lock 4697D Set Your Own Combination TSA Approved Luggage Lock, 1 Pack, Colors May Vary",B01BH5CVUS,LOCK,R_1TvhpEMhVBwUasN,8.74
2020-10-23,8.99,1.0,MT,"Master Lock Word Combination Lock, Set Your Own Word Lock, Combination Lock for Gym and School Lockers, Colors May Vary, 1535DWD",B009JTW84Y,LOCK,R_2w6Kv77UCoeyLbP,8.99
2022-07-26,8.99,1.0,MT,"dophee Oval Glass Cabochon for Jewelry Making, Clear Dome Tiles Cabochons with Flat Back, Dome Bead Cameo Cabochon Tile for DIY Craft Photo, Pendants, Rings, Necklace, 40x30mm, 10-Pack",B01F8S2WCM,LOOSE_CUT_GEM,R_2QQl58nFfrZayxf,8.99
2022-04-10,22.5,1.0,MT,Joico Body Shake Texturizing Finisher | Long-Lasting Volume & Fullness | For Fine to Medium Hair,B08V4P39KR,LUXURY_BEAUTY,R_2VJ7KiUFzWY3H0p,22.5
2022-07-12,47.2,1.0,MT,"Meaningful Beauty 5-Piece Starter Kit, Gift Set, various color",B07SXZYQWJ,LUXURY_BEAUTY,R_2w6Kv77UCoeyLbP,47.2
2021-04-15,3.48,1.0,MT,"3-IN-ONE - 120001 All-Temperature Silicone Drip Oil, 4 OZ",B00J25JCM6,MACHINE_LUBRICANT,R_2QQl58nFfrZayxf,3.48
2020-08-01,4.99,1.0,MT,"Permatex 81343 Anti-Seize Lubricant, 1 oz. Tube , White",B0002UEOLO,MACHINE_LUBRICANT,R_1TvhpEMhVBwUasN,4.99
2019-12-13,5.0,1.0,MT,Food & Wine,B002PXVZO0,MAGAZINES,R_2AHiSANbVno9jis,5.0
2020-10-13,19.99,1.0,MT,Food & Wine,B002PXVZO0,MAGAZINES,R_2AHiSANbVno9jis,19.99
2021-10-13,24.97,1.0,MT,Food & Wine,B002PXVZO0,MAGAZINES,R_2AHiSANbVno9jis,24.97
2019-12-02,2.99,1.0,MT,Real Simple,B07QRN3QTF,MAGAZINES,R_2AHiSANbVno9jis,2.99
2020-12-10,25.99,1.0,MT,"4392065 Dryer Repair Kit for whirlpool kenmore roper admiral maytag amana estate kitchenaid, Part Number: AP3131942 AP6010582 WP691366 AP3098345, Including Belt 341241, Idler 691366, Rollers 349241t",B083BNBSYG,MAJOR_HOME_APPLIANCES,R_2VJ7KiUFzWY3H0p,25.99
2018-09-25,14.67,1.0,MT,Lifetime Warranty 12001656 Oven Temperature Sensor Replacement Part by BlueStars - Exact Fit for Whirlpool & Kenmore Ovens - Replaces AP4009009 74004943 PS1570174 12001554 12001656VP 7430P003-60,B074DSGJXS,MAJOR_HOME_APPLIANCES,R_2VJ7KiUFzWY3H0p,14.67
2021-01-12,23.99,1.0,MT,PRYSM Bake Element Replaces 316075104,B07CMDTDMZ,MAJOR_HOME_APPLIANCES,R_2VJ7KiUFzWY3H0p,23.99
2019-06-14,4.99,1.0,MT,"UNBREAKABLE-W10861225 W10714516 Dryer Door Handle replaces for Amana, Crosley, Maytag, Whirlpool, Kenmore Roper AP5999398 PS11731583 W10861225VP",B077XWSM7L,MAJOR_HOME_APPLIANCES,R_2VJ7KiUFzWY3H0p,4.99
2019-07-09,39.99,1.0,MT,"Upgraded Dryer Repair Kit Compatible with Samsung Dryer Includes DC97-16782A Dryer Roller DC93-00634A Idler Pulley 6602-001655 Dryer Belt, Figures 6 and 7 are Fit Models",B07M87YFJS,MAJOR_HOME_APPLIANCES,R_2VJ7KiUFzWY3H0p,39.99
2021-04-09,20.82,1.0,MT,"Manual Coffee Bean Grinder with Ceramic Conical Burr Mill, 2 Glass Jars Ceramic Burr, for Drip Coffee, Turkish Brew, Espresso, French Press, Home Travel or Camping (Black)",B08SW6J2SN,MANUAL_FOOD_MILL_GRINDER,R_2QQl58nFfrZayxf,20.82
2022-11-10,8.99,1.0,MT,"Meat Chopper, Hamburger Chopper, Premium Heat Resistant Masher and Smasher for Hamburger Meat, Ground Beef, Ground Turkey and More, Nylon Ground Beef Chopper Tool and Meat Fork, Non Stick Mix Chopper",B08JKXDFQ9,MANUAL_FOOD_MILL_GRINDER,R_2w6Kv77UCoeyLbP,8.99
2020-01-14,7.95,1.0,MT,"TINKLE DORCO EYEBROW RAZOR, 5 PACKS (15 RAZORS) | DERMAPLANING RAZOR TOOL | HOLIDAY STOCKING STUFFERS",B0752W2MVJ,MANUAL_SHAVING_RAZOR,R_2w6Kv77UCoeyLbP,7.95
2020-03-06,29.99,1.0,MT,"60 Colors Alcohol Art Markers, Dual Tips Twin Artist Alcohol Based Sketch Markers with Case- Ideal for Adults Kids Drawing Coloring Gifts",B07VYWPC48,MARKING_PEN,R_1TvhpEMhVBwUasN,29.99
2019-03-13,6.99,1.0,MT,Dual Tip Marker Pens Set Permanent Double-Ended Art Markers Highlighter Pen for Adult Coloring Drawing Underlining School Office Supplier (16 Colors),B07JWF51KL,MARKING_PEN,R_1TvhpEMhVBwUasN,6.99
2020-03-06,21.99,1.0,MT,GenCrafts Watercolor Brush Pens Set of 20 Premium Colors - Real Brush Tips - No Mess Storage Case - Washable Nontoxic Markers - Portable Painting,B0717899NZ,MARKING_PEN,R_1TvhpEMhVBwUasN,21.99
2018-12-17,13.99,1.0,MT,Micro Line Ultra Fine Point Ink Pens - Set of 16 – 5 Black and 11 Assorted Colors – Journaling – Technical - Archival – Illustrating – Drawing - Essential Art Supplies,B071V5792L,MARKING_PEN,R_1TvhpEMhVBwUasN,13.99
2018-12-19,13.99,1.0,MT,"MozArt Supplies Dual Tip Brush Pen Marker Set - 12 Colors - Flexible Brush & Fineliner Tips - Watercolor Effects - Art Markers for Adult Coloring Books, Calligraphy, Lettering, Bullet Journal Pens",B01HA6CRVQ,MARKING_PEN,R_1TvhpEMhVBwUasN,13.99
2019-11-24,12.49,1.0,MT,"Mr. Sketch Chiseled Tip, 2054594, 22 Assorted Scented Markers",B07GSZM4YM,MARKING_PEN,R_3M0euO2kPnoHrdt,12.49
2020-12-21,2.54,1.0,MT,"SHARPIE Pocket Style Highlighters, Chisel Tip, Assorted Colors, 4 Count (Pack of 1)",B0012V77SO,MARKING_PEN,R_1TvhpEMhVBwUasN,2.54
2018-12-19,4.83,1.0,MT,"U Brands Low Odor Magnetic Double Ended Dry Erase Markers With Erasers, Bullet Tip, Assorted Colors, 6-Count",B01LY9H349,MARKING_PEN,R_1TvhpEMhVBwUasN,4.83
2020-12-31,4.99,1.0,MT,essence | Lash Princess False Lash Effect Mascara | Gluten & Cruelty Free,B00T0C9XRK,MASCARA,R_2w6Kv77UCoeyLbP,4.99
2022-05-31,29.99,1.0,MT,"2022 New Massage Gun,Deep Tissue Massager for Athletes,Portable Muscle Massage Gun for Back/Neck/Leg with 6 Interchangeable Heads 8 Speeds(Space Gray) Black Deals 2022",B08YN6PVMP,MASSAGER,R_262xe1Uv99c2Nwd,29.99
2021-04-21,15.29,1.0,MT,"KINGWAND Handheld Back Massager-Rechargeable Massager, Deep Tissue Massager, Used for Shoulder, Waist, Back Pain Relief, Portable Massager, Full Body Massage.",B089VMN7K8,MASSAGER,R_1gwL8QZGzhV0g3G,15.29
2021-12-11,39.99,1.0,MT,"cotsoco 6 Speeds Massage Gun, Cordless Handheld Deep Tissue Muscle Massager, Chargeable Percussion Device Super Quiet, Best Gifts from Wife Son Daughter",B07VNCWYQB,MASSAGER,R_6xIfoIXCDVAT19D,39.99
2019-09-15,225.0,1.0,MT,"Signature Design by Ashley Chime 12 Inch Plush Hybrid Mattress, CertiPUR-US Certified Foam, Queen White",B07BNS7T6V,MATTRESS,R_1TvhpEMhVBwUasN,225.0
2022-07-03,37.99,1.0,MT,"SafeRest Mattress Protector – Queen - College Dorm Room, New Home, First Apartment Essentials - Cotton, Waterproof Mattress Cover Protector and Encasement",B003PWNH4Q,MATTRESS_COVER,R_2w6Kv77UCoeyLbP,37.99
2021-09-24,16.99,1.0,MT,"Utopia Bedding Premium Waterproof Terry Mattress Protector Full 200 GSM, Mattress Cover, Breathable, Fitted Style with Stretchable Pockets (White)",B07PMFVC9X,MATTRESS_COVER,R_1gwL8QZGzhV0g3G,16.99
2019-09-15,9.99,1.0,MT,"Bentology Lunch Box for Boys - Kids Insulated, Durable Lunchbox Tote Bag Fits Bento Boxes, Nesting Containers w/ Lids & Bottles, Back to School Lunch Sleeve Keeps Food Hotter or Colder Longer, Octopus",B07NPXMFJ7,MEAL_HOLDER,R_3M0euO2kPnoHrdt,9.99
2020-08-29,17.57,2.0,MT,SF RTD ADV Crmy Choc 3/4PK,B0187HZG2E,MEAL_REPLACEMENT_BEVERAGE,R_2w6Kv77UCoeyLbP,35.14
2020-08-05,17.57,1.0,MT,SF RTD ADV Crmy Choc 3/4PK,B0187HZG2E,MEAL_REPLACEMENT_BEVERAGE,R_2w6Kv77UCoeyLbP,17.57
2020-06-16,17.57,1.0,MT,SF RTD ADV Crmy Choc 3/4PK,B0187HZG2E,MEAL_REPLACEMENT_BEVERAGE,R_2w6Kv77UCoeyLbP,17.57
2020-05-28,20.22,1.0,MT,SF RTD ADV Crmy Choc 3/4PK,B0187HZG2E,MEAL_REPLACEMENT_BEVERAGE,R_2w6Kv77UCoeyLbP,20.22
2022-07-13,36.98,1.0,MT,"Vegan Protein Meal Replacement Powder by Orgain - 20g of Protein, Certified Organic and Plant Based, No Gluten, Soy or Dairy, Non-GMO, Creamy Chocolate Fudge, 2.01lb (Packaging May Vary)",B00RWWOKHI,MEAL_REPLACEMENT_BEVERAGE,R_2w6Kv77UCoeyLbP,36.98
2021-04-15,13.99,1.0,MT,"HiGift 10 Pack Silicone Measuring Cups for Epoxy Resin, 300ml & 100ml Graduated Silicone Resin Mixing Cups, Nonstick Reusable Cups for Epoxy Resin, Jewelry Casting Molds, Acrylic Paint Pouring",B08QZBRPQ6,MEASURING_CUP,R_2QQl58nFfrZayxf,13.99
2021-04-09,19.99,1.0,MT,"OXO Good Grips 3 Piece Squeeze & Pour Silicone Measuring Cup Set, Blue",B01B7HSHMM,MEASURING_CUP,R_2QQl58nFfrZayxf,19.99
2021-04-09,11.99,1.0,MT,"SBYURE 100 Pack 30ml Plastic Graduated Cups Transparent Scale Cups Clear Epoxy Resin Paint Mixing Cups with 100 Pack Wooden Stirring Sticks for Mixing Resin, Epoxy, Stain",B07PCQDYMV,MEASURING_CUP,R_2QQl58nFfrZayxf,11.99
2018-03-29,9.0,1.0,MT,Iron Filings - 1 Pound Package,B008MB17GA,MECHANICAL_COMPONENTS,R_27NeinuChlzrANs,9.0
2022-07-31,9.99,1.0,MT,BTSHUB 415 pcs Door Trim Panel Clips Car Push Retainer Clips Plastic Bumper Rivets 18 Sizes Fasteners Nylon Car Door Panel Trim Clips Kit,B09M7B94F7,MECHANICAL_FASTENERS,R_1TvhpEMhVBwUasN,9.99
2022-09-18,11.99,1.0,MT,"Cigar Torch Lighter, Triple Jet Flame Cool Butane Refillable Cigar Lighter for Smoking with Punch, Stand",B09DD263ZP,MECHANICAL_LIGHTER,R_3lzv4o9axMfFsE2,11.99
2018-04-10,18.34,1.0,MT,SOTO Pocket Torch (Only – w/o Refillable Lighter),B0046UZRNU,MECHANICAL_LIGHTER,R_2VJ7KiUFzWY3H0p,18.34
2022-09-09,13.95,1.0,MT,"Elbow Brace Compression Sleeve (1 Pair) - Instant Arm Support Elbow Sleeves for Tendonitis, Arthritis, Bursitis, Golfers & Tennis Elbow Brace, Treatment, Workouts, Weightlifting, Pain Relief, Recovery",B07CQBVBJ9,MEDICAL_COMPRESSION_GARMENT,R_2w6Kv77UCoeyLbP,13.95
2019-05-09,49.95,1.0,MT,VIM & VIGR Nylon 15-20 mmHg Compression Tights for Women,B07FW86XKY,MEDICAL_COMPRESSION_GARMENT,R_2w6Kv77UCoeyLbP,49.95
2020-07-09,52.0,1.0,MT,ASTHMANEFRIN for asthma relief 30 ct (Pack of 2),B072LPYPGY,MEDICATION,R_2QQl58nFfrZayxf,52.0
2021-09-17,6.14,1.0,MT,"Amazon Basic Care Acetaminophen PM, Pain Reliever Plus Nighttime Sleep Aid, 100 Count",B074F2GP2F,MEDICATION,R_2w6Kv77UCoeyLbP,6.14
2021-04-02,15.99,1.0,MT,"Amazon Basic Care All Day Allergy, Cetirizine Hydrochloride Tablets, 10 mg, Antihistamine, 300 Count",B074F145Y1,MEDICATION,R_2w6Kv77UCoeyLbP,15.99
2020-05-24,9.88,1.0,MT,"Amazon Basic Care Maximum Strength Famotidine Tablets 20 mg, Acid Reducer for Heartburn Relief, 200 Count ( pack of 1)",B074F18H4B,MEDICATION,R_2w6Kv77UCoeyLbP,9.88
2021-04-02,12.99,1.0,MT,"GoodSense Allergy Relief Loratadine Tablets 10 mg, Antihistamine, Allergy Medicine for 24 Hour Allergy Relief, 365 Count",B00HE66ZUC,MEDICATION,R_2w6Kv77UCoeyLbP,12.99
2019-02-09,14.99,1.0,MT,Maoever Neti Pot Sinus Rinse Bottle Nose Wash Cleaner Pressure Rinse Nasal Irrigation for Adult & Kid BPA Free 300 ML with 30 Nasal Wash Salt Packets and Sticker Thermometer(Blue),B07HQ91761,MEDICATION,R_2QQl58nFfrZayxf,14.99
2022-09-04,14.4,1.0,MT,"Miers Labs No Jet Lag Homeopathic Jet Lag Remedy (1 Pack, 32 Chewable Tablets), Travel Must Have, Flight Essential for Jet Lag Relief, Plant-Based",B00007KUX7,MEDICATION,R_2VJ7KiUFzWY3H0p,14.4
2020-02-16,14.99,1.0,MT,"Refresh Optive Mega-3 Lubricant Eye Drops, Preservative-Free, 0.01 Fl Oz Single-Use Containers, 30 Count",B074ZHK96H,MEDICATION,R_3M0euO2kPnoHrdt,14.99
2020-10-05,23.74,1.0,MT,"Vicks VapoRub, Chest Rub Ointment, Relief from Cough, Cold, Aches, & Pains with Original Medicated Vicks Vapors, Topical Cough Suppressant, 6 OZ each (Pack of 2)",B001G7QUU0,MEDICATION,R_xzt7BAlQUA8iNyh,23.74
2019-08-17,10.0,1.0,MT,Zheng Gu Shui External Analgesic Lotion (Spray) (2.0 Fl Oz) 1 Bottle,B001TLL2D8,MEDICATION,R_2VJ7KiUFzWY3H0p,10.0
2018-12-27,11.19,1.0,MT,Zheng Gu Shui External Analgesic Lotion (Spray) (2.0 Fl Oz) 1 Bottle,B001TLL2D8,MEDICATION,R_2VJ7KiUFzWY3H0p,11.19
2022-08-29,17.99,1.0,MT,"Anker 2-in-1 USB 3.0 SD Card Reader for SDXC, SDHC, SD, MMC, RS-MMC, Micro SDXC, Micro SD, Micro SDHC Card and UHS-I Cards",B006T9B6R2,MEMORY_CARD_READER,R_1TvhpEMhVBwUasN,17.99
2019-01-11,109.27,1.0,MT,"Logitech for Creators Blue Yeti USB Microphone for PC, Podcast, Gaming, Streaming, Studio, Computer Mic - Whiteout",B014PYGYRE,MICROPHONE,R_DtPfbKjVP7QqLVD,109.27
2020-12-29,38.69,1.0,MT,"Piy Painting USB Microphone Kit, Condenser Microphone Kit with 192KHZ/24Bit Studio Mic Sound Chipset Scissor Arm, Plug & Play Recording Microphone for PC Gaming Streaming Podcasting",B088NZHD42,MICROPHONE,R_2QQl58nFfrZayxf,38.69
2021-06-22,5.59,1.0,MT,"Pop Filter,Aokeo [Upgraded Three Layers] Metal Mesh & Foam & Etamine Layer Microphone Windscreen Cover Handheld Mic Shield Mask,Microphone Accessories for Vocal Recording,Youtube videos,Streaming",B07QP2FXTB,MICROPHONE,R_1TvhpEMhVBwUasN,5.59
2021-06-22,5.59,1.0,MT,"Pop Filter,Aokeo [Upgraded Three Layers] Metal Mesh & Foam & Etamine Layer Microphone Windscreen Cover Handheld Mic Shield Mask,Microphone Accessories for Vocal Recording,Youtube videos,Streaming",B07QP2FXTB,MICROPHONE,R_1TvhpEMhVBwUasN,5.59
2021-06-22,55.99,1.0,MT,Razer Seiren X USB Streaming Microphone: Professional Grade - Built-in Shock Mount - Supercardiod Pick-Up Pattern - Anodized Aluminum - Classic Black,B075HCLMYP,MICROPHONE,R_1TvhpEMhVBwUasN,55.99
2021-08-19,29.99,1.0,MT,"eKids Disney Frozen 2 Bluetooth Karaoke Microphone with LED Disco Party Lights, Portable Speaker Compatible with Siri Google Assistant, for Fans of Frozen Toys and Gifts",B07V6XFPQP,MICROPHONE,R_1ogPEvMIjoSK6eE,29.99
2019-01-11,13.99,1.0,MT,"NEEWER Adjustable Microphone Suspension Boom Scissor Arm Stand, Max Load 1 KG Mic Stand for Radio Broadcasting, Voice-Over, Stage and TV Stations, Compatible with Blue Yeti Snowball Yeti X,etc (White)",B00DFUEZZI,MICROPHONE_STAND,R_DtPfbKjVP7QqLVD,13.99
2021-01-05,9.99,1.0,MT,Carlyle Ultra Chromium Picolinate 1000mcg 360 Tablets,B07CJ166BR,MINERAL_SUPPLEMENT,R_2QQl58nFfrZayxf,9.99
2020-02-15,35.49,1.0,MT,"Natural Vitality Calm, Magnesium Citrate Supplement, Stress Relief Gummies, Supports a Healthy Response to Stress, Gluten Free, Vegan, Raspberry Lemon, 240 Gummies",B078KJLT6G,MINERAL_SUPPLEMENT,R_3M0euO2kPnoHrdt,35.49
2019-10-05,35.77,1.0,MT,"Natural Vitality Calm, Magnesium Citrate Supplement, Stress Relief Gummies, Supports a Healthy Response to Stress, Gluten Free, Vegan, Raspberry Lemon, 240 Gummies",B078KJLT6G,MINERAL_SUPPLEMENT,R_3M0euO2kPnoHrdt,35.77
2020-07-06,35.79,1.0,MT,"Natural Vitality Calm, Magnesium Citrate Supplement, Stress Relief Gummies, Supports a Healthy Response to Stress, Gluten Free, Vegan, Raspberry Lemon, 240 Gummies",B078KJLT6G,MINERAL_SUPPLEMENT,R_3M0euO2kPnoHrdt,35.79
2022-10-12,5.57,1.0,MT,"Nature Made Iron 65 mg (325 mg Ferrous Sulfate) Tablets, Dietary Supplement for Red Blood Cell Support, 180 Tablets, 180 Day Supply",B003PGJLRO,MINERAL_SUPPLEMENT,R_2w6Kv77UCoeyLbP,5.57
2021-01-05,27.96,1.0,MT,"Nature’s Bounty Magnesium 500mg Tablets, Supports Bone & Muscle Health, Twin Pack, 400 Tablets",B08C65K2WC,MINERAL_SUPPLEMENT,R_2QQl58nFfrZayxf,27.96
2020-05-16,21.99,1.0,MT,"Nutricost Zinc Picolinate 50mg, 240 Vegetarian Capsules - Gluten Free and Non-GMO (240 Caps)",B07735XF2K,MINERAL_SUPPLEMENT,R_2QQl58nFfrZayxf,21.99
2020-06-20,21.9,1.0,MT,"Extra Large, XL White Cotton Gloves for Moisturizing Dry Hands, Use Overnight Bedtime, Cosmetic Inspection Premium Cloth Quality, for Men, Eczema Sensitive Skin Spa Therapy (100% Cotton, 8 Pairs)",B07YZG4NJ5,MOISTURIZING_SOCK_GLOVE,R_3M0euO2kPnoHrdt,21.9
2021-12-25,229.0,1.0,MT,"ASUS VG278QR 27” Gaming Monitor 165Hz Full HD (1920 x 1080) 0.5ms G-SYNC Eye Care DisplayPort HDMI DVI, Black",B07XV1519W,MONITOR,R_1TvhpEMhVBwUasN,229.0
2020-12-04,249.0,1.0,MT,"ASUS VG278QR 27” Gaming Monitor 165Hz Full HD (1920 x 1080) 0.5ms G-SYNC Eye Care DisplayPort HDMI DVI, Black",B07XV1519W,MONITOR,R_1TvhpEMhVBwUasN,249.0
2018-10-02,288.88,1.0,MT,Acer CB271HU bmidprx 27” IPS 2K/QHD 2560x1440 4ms(GTG) Monitor,B07B9M7CQC,MONITOR,R_DtPfbKjVP7QqLVD,288.88
2020-11-02,62.99,1.0,MT,ASROCK H410M-HDV/M.2 Supports 10th Gen Intel® Core™ Processors (Socket 1200) Motherboard,B088ZVZ8Q4,MOTHERBOARD,R_3lzv4o9axMfFsE2,62.99
2019-07-28,4.99,1.0,MT,"BOSOBO Mouse Pad, Round Mandala Mouse Mat, Cute Mouse Pad with Design, Non-Slip Rubber Base Mousepad with Stitched Edge, Waterproof Women Office Mouse Pads, Small Size 7.9 x 7.9 Inch, Pretty Mandala",B07LH6L2W6,MOUSE_PAD,R_27NeinuChlzrANs,4.99
2021-02-19,12.74,1.0,MT,"Large Gaming Mouse Pad XXL/Extended Mat Desk Pad 36""x12"" GLTECK Mousepad Long Non-Slip Rubber Mice Pads Stitched Edges with Portable Bag",B01FTQUC2K,MOUSE_PAD,R_3lzv4o9axMfFsE2,12.74
2018-12-19,6.99,1.0,MT,"Smooffly Non Slip Mouse Pad for Office, Computer, Laptop & Mac - Durable & Comfortable & Lightweight for Easy Typing-Art Grunge Stylized Damask Pattern with Circles Floral Ornament in Blue",B07B48F3CM,MOUSE_PAD,R_1TvhpEMhVBwUasN,6.99
2022-10-30,14.07,1.0,MT,"Listerine Total Care Alcohol-Free Anticavity Mouthwash, 6 Benefit Fluoride Mouthwash for Bad Breath and Enamel Strength, Fresh Mint Flavor, Twin Pack, 2 x 1 L",B0054J2GDQ,MOUTHWASH,R_1TvhpEMhVBwUasN,14.07
2021-03-26,11.99,1.0,MT,Sabrent 4-Port USB 3.0 Hub with Individual LED Power Switches (HB-UM43),B00JX1ZS5O,MULTIPORT_HUB,R_3lzv4o9axMfFsE2,11.99
2019-12-02,24.99,1.0,MT,"B. Toys by Battat Toddler Musical Instrument Set – Jungle Animals Percussion Toys for Kids – 9 Pcs – Drums, Tambourine, Maracas, Whistles & More – 2 Years +, Multicolor",B07PBDGZ6G,MUSICAL_INSTRUMENT_TOY,R_3M0euO2kPnoHrdt,24.99
2020-03-12,10.99,1.0,MT,"Stainless Steel Nail File with Anti-Slip Handle and Leather Case, Double Sided and Files Nails Easily for Men and Woman",B07BDFDHJY,NAIL_FILE,R_27NeinuChlzrANs,10.99
2020-03-12,6.99,1.0,MT,"Tachibelle 2 pcs Pack Kit KOREA 4-Way Shiny Buffer Super Shine - Smooth, Shine, For Healthy & Shiny Nails",B07PP917WR,NAIL_FILE,R_27NeinuChlzrANs,6.99
2021-10-08,21.24,1.0,MT,"MEFA 23 Pcs Gel Nail Polish Set, Nail Gel Kit Spring with Glossy & Matte Top and Base Coat, Black Glitter White Pink Blue Collection with Classic Colors All Seasons Gift for Starter Manicure Nail Art Salon",B085334F93,NAIL_POLISH,R_1gwL8QZGzhV0g3G,21.24
2019-09-26,18.99,1.0,MT,"Makartt Gel Nail Polish Kit, 6 Colors Gel Nail Polish Set Pink Wine Red Purple Fall Color Soak Off UV Gel Nail Polish 10ml Nail Polish Gel For Nail Art Salon DIY at Home, Gift for Valentine's Day",B07HKGYFW9,NAIL_POLISH,R_1gwL8QZGzhV0g3G,18.99
2021-10-11,11.99,1.0,MT,"Sally Hansen Miracle Gel Nail Polish, Once Chiffon A Time, Dual Ended Nail Gel Color + Top Coat, Gel Nail Polish, Color Nail Polish, Gel Top Coat, Sheer, No UV Light, Long Lasting",B092YLPGTF,NAIL_POLISH,R_2w6Kv77UCoeyLbP,11.99
2020-01-31,11.91,1.0,MT,"Sally Hansen Salon Pro Gel, Pro-Gel Base Coat, 0.14 Fluid Ounce",B00BEQGA9Y,NAIL_POLISH,R_1gwL8QZGzhV0g3G,11.91
2022-01-24,6.99,1.0,MT,Vishine Base Coat & No Wipe No Clean Top Coat UV LED Gel Nail Polish Soak Off Varnish Set 8ml,B07FX93VBT,NAIL_POLISH,R_2w6Kv77UCoeyLbP,6.99
2022-01-24,6.99,1.0,MT,Vishine Gel Nail Polish Glitter UV Gel Soak Off Nail Gel Polish Manicure Pedicure Long-Lasting Diamond Glitter 15ml,B08YYRMY85,NAIL_POLISH,R_2w6Kv77UCoeyLbP,6.99
2022-01-24,14.99,1.0,MT,"Vishine Nude Gel Polish Kit, Sheer Milky Pink Jelly Transparent Gel Nail Polish UV LED Gel Nail Gel Polish Varnish Nail Art DIY Saon 6Pcs 8ML",B09L7LBP2P,NAIL_POLISH,R_2w6Kv77UCoeyLbP,14.99
2022-01-24,3.59,1.0,MT,Vishine Varnish Gel Nail Polish Soak Off UV LED Nail Art Manicure 10ml Nude Knickers (90485),B014MIBF8G,NAIL_POLISH,R_2w6Kv77UCoeyLbP,3.59
2019-08-22,8.99,1.0,MT,Cleaning Nail Brush Handle Scrubbing Brushes (Plastic Brush-4 Pcs),B07Q3DYDFS,NAIL_POLISH_BRUSH,R_27NeinuChlzrANs,8.99
2022-01-30,13.49,1.0,MT,"Gel Nail Polish Remover, (2PACK) Easily & Quickly Soak off Gel Polish No Need for Foil, Soaking or Wrapping, Remove Gel Nail Polish within 3-5 Minutes, Professional Nail Polish Remover 0.5 Fl Oz",B09C7RMYFK,NAIL_POLISH_REMOVER,R_2w6Kv77UCoeyLbP,13.49
2020-05-31,6.75,1.0,MT,"Mountain Falls Regular Nail Polish Remover for Natural Nails with Vitamin E and Panthenol, 10 Fluid Ounce",B07S8F3GWK,NAIL_POLISH_REMOVER,R_2w6Kv77UCoeyLbP,6.75
2022-01-30,8.99,1.0,MT,"Teenitor Nail Gel Remover Tools Kit with Pink Polish Remover Clips, Cuticle Peeler Scraper, Gel Nail Brush, 115 Pack Nail Wipe Cotton Pads, Nail File Grits 120/180 Buffer Block Grits 400/4000",B07NHWPC99,NAIL_POLISH_REMOVER,R_2w6Kv77UCoeyLbP,8.99
2021-06-16,12.99,1.0,MT,40 Pieces Transparent Glass Cabochons with 40pcs Stainless Steel Pendant Trays Clear Round Dome Non-Calibrated 25mm for Photo Craft Jewelry Making,B07D6LWHTQ,NECKLACE,R_2QQl58nFfrZayxf,12.99
2020-12-17,12.95,1.0,MT,Dremmy Studios Dainty Gold 18K Gold Filled Simple Disc Carved Pendant Paperclip Chain Coin Necklace Gift for Her,B08P8B45BR,NECKLACE,R_1TvhpEMhVBwUasN,12.95
2020-02-06,16.99,1.0,MT,EVER FAITH 925 Sterling Silver CZ Cursive Initial 26 Letters Alphabet Adjustable Pendant Necklace Clear,B0773JSFD2,NECKLACE,R_1TvhpEMhVBwUasN,16.99
2021-03-10,25.0,1.0,MT,"FashionJunkie4Life Sterling Silver Sweet 16 Birthday Heart Photo Locket Necklace, 18"" Chain",B0196DC5K4,NECKLACE,R_1TvhpEMhVBwUasN,25.0
2021-09-23,12.99,1.0,MT,"Gold Layered Initial Necklaces for Women, 14K Real Gold Plated Paperclip Chain Necklace Coin Initial Necklaces Gold Choker Necklaces for Women Letter Necklaces Gold Jewelry for Women Teen Girls",B08XZ2RK5Y,NECKLACE,R_2w6Kv77UCoeyLbP,12.99
2021-04-30,12.99,1.0,MT,"Stainless Steel Bead Chain Necklace & Matching Connector Pack, obmwang 50pcs 30"" Long Adjustable Metal Ball Chains with 50pcs Extra Connectors Jewelry Findings (2mm Bead)",B07GBXKJZ6,NECKLACE,R_2QQl58nFfrZayxf,12.99
2021-12-22,6.99,1.0,MT,"Vintage Art Greek Mythology God Zeus Necklace，Archangel Raphael Necklac 925 Sterling Silver Medallion With Runes, Greek Myths Greek God Roman Men Necklace, God Zeus Amulet Pendant Necklace, Powerful Men Necklace",B08YK4PXWG,NECKLACE,R_1TvhpEMhVBwUasN,6.99
2020-02-25,17.95,1.0,MT,Amazon Basics USB 3.0 to 10/100/1000 Gigabit Ethernet Internet Adapter,B00M77HMU0,NETWORK_INTERFACE_CONTROLLER_ADAPTER,R_2QQl58nFfrZayxf,17.95
2018-09-12,15.99,1.0,MT,"EDUP AC600M USB WiFi Adapter for PC, Wireless USB Network Adapters Dual Band 2.4G/5.8Ghz Wi-Fi Dongle with Antenna for Laptop Desktop Compatible Windows 10/11/8.1/8/7/XP/Vista /Mac OS X 10.6~10.15.3",B01CCMUN8C,NETWORK_INTERFACE_CONTROLLER_ADAPTER,R_27NeinuChlzrANs,15.99
2022-10-15,59.99,1.0,MT,"TP-Link AV1000 Powerline Ethernet Adapter(TL-PA7017P KIT)- Gigabit Port, Plug and Play, Extra Power Socket for Additional Devices, Ideal for Smart TV",B08M13B8B6,NETWORK_INTERFACE_CONTROLLER_ADAPTER,R_2us4qPSxiD4clPq,59.99
2022-10-18,88.77,1.0,MT,"TP-Link AV2000 Powerline Adapter - 2 Gigabit Ports, Ethernet Over Power, Plug&Play, Power Saving, 2x2 MIMO, Noise Filtering, Extra Power Socket for other Devices, Ideal for Gaming (TL-PA9020P KIT)",B01H74VKZU,NETWORK_INTERFACE_CONTROLLER_ADAPTER,R_2us4qPSxiD4clPq,88.77
2021-10-25,9.99,1.0,MT,"TP-Link USB Bluetooth Adapter for PC(UB400), 4.0 Bluetooth Dongle Receiver Support Windows 11/10/8.1/8/7/XP for Desktop, Laptop, Mouse, Keyboard, Printers, Headsets, Speakers, PS4/ Xbox Controllers",B07V1SZCY6,NETWORK_INTERFACE_CONTROLLER_ADAPTER,R_3lzv4o9axMfFsE2,9.99
2022-01-14,14.29,1.0,MT,Avidlove Women Deep V Halter Lingerie Teddy One Piece Bodysuit Lace Babydoll,B0765ZJ5WP,NIGHTGOWN_NIGHTSHIRT,R_3lzv4o9axMfFsE2,14.29
2020-05-04,17.99,1.0,MT,Avidlove Women Lingerie Lace Chemise Sleepwear Babydoll Teddy Lingerie Blue,B07W1W4SL5,NIGHTGOWN_NIGHTSHIRT,R_2w6Kv77UCoeyLbP,17.99
2020-05-04,17.98,1.0,MT,Avidlove Women Lingerie Satin Lace Chemise Nightgown Sexy Full Slips Sleepwear Coffee XX-Large,B07YP4DPR1,NIGHTGOWN_NIGHTSHIRT,R_2w6Kv77UCoeyLbP,17.98
2021-02-18,15.83,1.0,MT,Avidlove Women Lingerie Satin Lace Chemise Nightgown Sexy Full Slips Sleepwear S-4XL,B07WW2XHXF,NIGHTGOWN_NIGHTSHIRT,R_2w6Kv77UCoeyLbP,15.83
