Order Date,Purchase Price Per Unit,Quantity,Shipping Address State,Title,ASIN/ISBN (Product Code),Category,Survey ResponseID,Total Value
2019-09-15,7.14,1.0,MT,"100 Write-and-Learn Sight Word Practice Pages: Engaging Reproducible Activity Pages That Help Kids Recognize, Write, and Really LEARN the Top 100 High-Frequency Words That are Key to Reading Success",0439365627,ABIS_BOOK,R_3M0euO2kPnoHrdt,7.14
2019-09-15,6.95,1.0,MT,52 Activities in Nature (52 Series),0811810968,ABIS_BOOK,R_3M0euO2kPnoHrdt,6.95
2019-01-23,23.02,1.0,MT,A Concise History of Japan (Cambridge Concise Histories),052117872X,ABIS_BOOK,R_DtPfbKjVP7QqLVD,23.02
2019-08-26,33.95,1.0,MT,A History of American Higher Education,1421428830,ABIS_BOOK,R_2AHiSANbVno9jis,33.95
2018-01-23,25.54,1.0,MT,A History of Italian Cinema,1441160698,ABIS_BOOK,R_DtPfbKjVP7QqLVD,25.54
2019-10-05,15.75,1.0,MT,A Kid's Guide to Native American History: More than 50 Activities (A Kid's Guide series),1556528027,ABIS_BOOK,R_3M0euO2kPnoHrdt,15.75
2021-11-25,9.95,1.0,MT,A Kid's Guide to Puerto Rico,1978148364,ABIS_BOOK,R_2VJ7KiUFzWY3H0p,9.95
2022-08-23,25.0,1.0,MT,Algebra I Project-Based Curriculum Test Booklet,1092744908,ABIS_BOOK,R_2VJ7KiUFzWY3H0p,25.0
2022-08-23,60.0,1.0,MT,Algebra I Project-Based Curriculum: Aligned with the Common Core State Standards,1091267820,ABIS_BOOK,R_2VJ7KiUFzWY3H0p,60.0
2022-07-27,10.74,1.0,MT,All the Light We Cannot See: A Novel,1501173219,ABIS_BOOK,R_1TvhpEMhVBwUasN,10.74
2019-12-06,50.0,1.0,MT,Amazon.com Gift Card in a Reveal (Various Designs),B071HFGN9N,ABIS_BOOK,R_3e5g4lvddcnjkoZ,50.0
2019-09-14,7.19,1.0,MT,Animal Farm: 75th Anniversary Edition,0451526341,ABIS_BOOK,R_1TvhpEMhVBwUasN,7.19
2018-06-15,8.99,1.0,MT,"Be Brave Little One: An Inspiring Book About Courage For Babies, Baby Showers, Graduation, And More",1492658812,ABIS_BOOK,R_3g1vpqtwzgBUs93,8.99
2019-12-21,7.99,1.0,MT,Beginner Hangul Writing Practice Workbook: Learn To Read The Korean Alphabet and Practice Your Penmanship In This Notebook (Learning Korean),1795672447,ABIS_BOOK,R_1TvhpEMhVBwUasN,7.99
2021-08-27,8.69,1.0,MT,Bird by Bird: Some Instructions on Writing and Life,0385480016,ABIS_BOOK,R_1TvhpEMhVBwUasN,8.69
2018-08-08,39.99,1.0,MT,Birds Without Borders,0986178209,ABIS_BOOK,R_2VJ7KiUFzWY3H0p,39.99
2019-12-29,12.59,1.0,MT,Birnbaum's 2020 Walt Disney World: The Official Vacation Guide (Birnbaum Guides),136802758X,ABIS_BOOK,R_3M0euO2kPnoHrdt,12.59
2021-11-14,15.99,1.0,MT,"Braids & Buns Ponies & Pigtails: 50 Hairstyles Every Girl Will Love (Hairstyle Books for Girls, Hair Guides for Kids, Hair Braiding Books, Hair Ideas for Girls)",1452151601,ABIS_BOOK,R_2VJ7KiUFzWY3H0p,15.99
2019-04-21,1.99,1.0,MT,Build Your Own Cupcake Sticker Activity Book (Dover Little Activity Books Stickers),048648243X,ABIS_BOOK,R_vIAsy23dmSRObGF,1.99
2020-01-24,12.66,1.0,MT,"Carry On, Warrior: The Power of Embracing Your Messy, Beautiful Life",1451698224,ABIS_BOOK,R_3M0euO2kPnoHrdt,12.66
2020-03-12,6.95,1.0,MT,Celtic and Old Norse Designs (Dover Pictorial Archive),486412296,ABIS_BOOK,R_27NeinuChlzrANs,6.95
2019-09-15,7.95,1.0,MT,Cracking Up: A Story About Erosion (Science Works),1404819967,ABIS_BOOK,R_3M0euO2kPnoHrdt,7.95
2019-06-11,26.49,1.0,MT,Cracking the Coding Interview: 189 Programming Questions and Solutions,0984782850,ABIS_BOOK,R_1TvhpEMhVBwUasN,26.49
2021-08-31,33.26,1.0,MT,Culturally Responsive Teaching and The Brain: Promoting Authentic Engagement and Rigor Among Culturally and Linguistically Diverse Students,1483308014,ABIS_BOOK,R_2VJ7KiUFzWY3H0p,33.26
2019-01-23,13.11,1.0,MT,Diary of Lady Murasaki (Penguin Classics),014043576X,ABIS_BOOK,R_DtPfbKjVP7QqLVD,13.11
2018-01-23,39.86,1.0,MT,Directing the Documentary (Portuguese and English Edition),415719305,ABIS_BOOK,R_DtPfbKjVP7QqLVD,39.86
2021-12-06,1.15,1.0,MT,Doctor Who Coloring Book,0399542299,ABIS_BOOK,R_3lzv4o9axMfFsE2,1.15
2022-02-20,4.99,1.0,MT,Doctor Who Travels in Time Coloring Book,0451534255,ABIS_BOOK,R_3lzv4o9axMfFsE2,4.99
2022-08-06,12.79,1.0,MT,Effin' Birds: A Field Guide to Identification,1984856286,ABIS_BOOK,R_2AHiSANbVno9jis,12.79
2019-07-30,12.98,1.0,MT,Ellie the Elephant Makes New Friends at School,1719847398,ABIS_BOOK,R_3M0euO2kPnoHrdt,12.98
2019-01-30,17.95,1.0,MT,Essays in Idleness,231112556,ABIS_BOOK,R_DtPfbKjVP7QqLVD,17.95
2018-08-12,12.74,1.0,MT,Everything Is Mama,1250125847,ABIS_BOOK,R_3g1vpqtwzgBUs93,12.74
2018-01-04,15.05,1.0,MT,Exhibit Makeovers: A Do-It-Yourself Workbook for Small Museums (American Association for State and Local History),759109974,ABIS_BOOK,R_27NeinuChlzrANs,15.05
2018-09-19,27.01,1.0,MT,Film and Video Budgets 6,1615932216,ABIS_BOOK,R_DtPfbKjVP7QqLVD,27.01
2019-07-30,12.56,1.0,MT,"Firenze's Light: A Firefly Book about Gratitude, Compassion and Self-Appreciation",0991460707,ABIS_BOOK,R_3M0euO2kPnoHrdt,12.56
2019-10-30,9.96,1.0,MT,First Lessons in Beekeeping,0915698129,ABIS_BOOK,R_2VJ7KiUFzWY3H0p,9.96
2021-11-25,17.62,1.0,MT,Fodor's Puerto Rico (Full-color Travel Guide),1640973966,ABIS_BOOK,R_2VJ7KiUFzWY3H0p,17.62
2022-01-23,16.98,1.0,MT,Four-Step Watercolour,1782218505,ABIS_BOOK,R_2w6Kv77UCoeyLbP,16.98
2022-12-19,5.95,1.0,MT,"Fun Puzzlers Number Search: 101 Puzzles Volume 1: 5"" x 8"" Pocket Size (Fun Puzzlers Travel Size Number Search Books)",1671575652,ABIS_BOOK,R_1TvhpEMhVBwUasN,5.95
2018-01-23,12.83,1.0,MT,Games People Play: The Basic Handbook of Transactional Analysis.,345410033,ABIS_BOOK,R_DtPfbKjVP7QqLVD,12.83
2019-09-20,9.49,1.0,MT,"Get Started in Leather Crafting: Step-by-Step Techniques and Tips for Crafting Success (Design Originals) Beginner-Friendly Projects, Basics of Leather Preparation, Tools, Stamps, Embossing, & More",1497203465,ABIS_BOOK,R_2w6Kv77UCoeyLbP,9.49
2019-01-10,13.79,1.0,MT,"Girl, Wash Your Face: Stop Believing the Lies About Who You Are So You Can Become Who You Were Meant to Be",1400201659,ABIS_BOOK,R_2w6Kv77UCoeyLbP,13.79
2019-12-02,39.74,1.0,MT,Harry Potter Paperback Box Set (Books 1-7),0545162076,ABIS_BOOK,R_2AHiSANbVno9jis,39.74
2020-01-05,22.49,1.0,MT,Harry Potter and the Chamber of Secrets: The Illustrated Edition (2),0545791324,ABIS_BOOK,R_3M0euO2kPnoHrdt,22.49
2020-02-21,28.79,1.0,MT,"Harry Potter and the Goblet of Fire: The Illustrated Edition (Harry Potter, Book 4) (4)",0545791421,ABIS_BOOK,R_3M0euO2kPnoHrdt,28.79
2020-01-24,21.42,1.0,MT,Harry Potter and the Prisoner of Azkaban: The Illustrated Edition (3),0545791340,ABIS_BOOK,R_3M0euO2kPnoHrdt,21.42
2019-09-15,9.99,1.0,MT,Harry and the Hot Lava,1623955750,ABIS_BOOK,R_3M0euO2kPnoHrdt,9.99
2023-01-07,14.89,1.0,MT,His Dark Materials 3-Book Paperback Boxed Set: The Golden Compass; The Subtle Knife; The Amber Spyglass,0440419514,ABIS_BOOK,R_1TvhpEMhVBwUasN,14.89
2022-07-27,9.5,1.0,MT,"How to Read Literature Like a Professor: A Lively and Entertaining Guide to Reading Between the Lines, Revised Edition",0062301675,ABIS_BOOK,R_1TvhpEMhVBwUasN,9.5
2021-08-27,8.65,1.0,MT,I Am Malala: The Girl Who Stood Up for Education and Was Shot by the Taliban,0316322423,ABIS_BOOK,R_1TvhpEMhVBwUasN,8.65
2022-03-22,2.98,1.0,MT,I'm a Unicorn (Little Golden Book),1524715123,ABIS_BOOK,R_1ogPEvMIjoSK6eE,2.98
2022-08-10,14.39,1.0,MT,Instant Wall Art - Botanical Prints: 45 Ready-to-Frame Vintage Illustrations for Your Home Decor,1440585660,ABIS_BOOK,R_27NeinuChlzrANs,14.39
2019-09-15,17.99,1.0,MT,"Island Grows, An",0066239303,ABIS_BOOK,R_3M0euO2kPnoHrdt,17.99
2022-12-22,5.95,1.0,MT,Jane Eyre (Bantam Classics),0553211404,ABIS_BOOK,R_1TvhpEMhVBwUasN,5.95
2019-07-30,9.33,1.0,MT,Jilly's Terrible Temper Tantrums: And How She Outgrew Them,0983866414,ABIS_BOOK,R_3M0euO2kPnoHrdt,9.33
2020-11-18,11.99,1.0,MT,Just Boxers 2021 Box Calendar (Dog Breed Calendar),1549214225,ABIS_BOOK,R_1gwL8QZGzhV0g3G,11.99
2022-03-29,8.82,1.0,MT,"Layered Curriculum: The Practical Solution for Teachers with More Than One Student in Their Classroom, Second Edition",1929358121,ABIS_BOOK,R_2VJ7KiUFzWY3H0p,8.82
2022-03-29,3.06,1.0,MT,Layered Curriculum: The Workbook,1929358105,ABIS_BOOK,R_2VJ7KiUFzWY3H0p,3.06
2019-06-11,7.22,1.0,MT,Let My People Go Surfing: The Education of a Reluctant Businessman--Including 10 More Years of Business Unusual,0143109677,ABIS_BOOK,R_2AHiSANbVno9jis,7.22
2018-08-12,7.9,1.0,MT,Madeline,0670445800,ABIS_BOOK,R_3g1vpqtwzgBUs93,7.9
2020-08-26,18.99,1.0,MT,"Making Leather Bags, Wallets, and Cases: 20+ Projects with Contemporary Style",811738310,ABIS_BOOK,R_2w6Kv77UCoeyLbP,18.99
2020-01-03,5.19,1.0,MT,"Mastering Copperplate Calligraphy: A Step-by-Step Manual (Lettering, Calligraphy, Typography)",486409511,ABIS_BOOK,R_27NeinuChlzrANs,5.19
2019-10-13,23.7,1.0,MT,"Mastering Essential Math Skills, Book 1: Grades 4 and 5, 3rd Edition: 20 minutes a day to success (Stepping Stones to Proficiency in Algebra)",0999443372,ABIS_BOOK,R_2VJ7KiUFzWY3H0p,23.7
2022-08-03,7.99,1.0,MT,Milk and Vine: Inspirational Quotes From Classic Vines,1973124262,ABIS_BOOK,R_2AHiSANbVno9jis,7.99
2018-06-22,4.28,1.0,MT,Mountain Spirit: The Sheep Eater Indians of Yellowstone,874808677,ABIS_BOOK,R_27NeinuChlzrANs,4.28
2019-09-15,11.69,1.0,MT,My Kindergarten Math Workbook: 101 Games and Activities to Support Kindergarten Math Skills (My Workbook),1641524634,ABIS_BOOK,R_3M0euO2kPnoHrdt,11.69
2019-12-26,9.95,1.0,MT,"Never Chase Men Again: 38 Dating Secrets To Get The Guy, Keep Him Interested, And Prevent Dead-End Relationships",1514128381,ABIS_BOOK,R_2w6Kv77UCoeyLbP,9.95
2019-09-14,7.86,1.0,MT,Night (Night),0374500010,ABIS_BOOK,R_1TvhpEMhVBwUasN,7.86
2018-03-02,30.25,1.0,MT,Obama: An Intimate Portrait,0316512583,ABIS_BOOK,R_1kIbViWVBImEaHV,30.25
2018-01-23,12.83,1.0,MT,On Directing Film,140127224,ABIS_BOOK,R_DtPfbKjVP7QqLVD,12.83
2019-01-30,31.91,1.0,MT,Our Land Was A Forest: An Ainu Memoir (Transitions--Asia and the Pacific),813318807,ABIS_BOOK,R_DtPfbKjVP7QqLVD,31.91
2019-08-03,15.42,1.0,MT,Paint and Frame: Botanical Painting: Nearly 20 Inspired Projects to Paint and Frame Instantly (Paint & Frame),1631064983,ABIS_BOOK,R_2AHiSANbVno9jis,15.42
2019-09-15,3.99,1.0,MT,Pete the Cat: Pete at the Beach (My First I Can Read),0062110721,ABIS_BOOK,R_3M0euO2kPnoHrdt,3.99
2019-09-15,4.49,1.0,MT,Pete the Cat: Sir Pete the Brave (My First I Can Read),0062404210,ABIS_BOOK,R_3M0euO2kPnoHrdt,4.49
2019-09-15,9.75,1.0,MT,Phonics Power! (Teenage Mutant Ninja Turtles): 12 Step into Reading Books,0385384823,ABIS_BOOK,R_3M0euO2kPnoHrdt,9.75
2019-09-15,3.84,1.0,MT,Planet Earth/Inside Out,0688158498,ABIS_BOOK,R_3M0euO2kPnoHrdt,3.84
2022-03-10,4.75,1.0,MT,Preservation Politics: Keeping Historic Districts Vital (American Association for State and Local History),075912051X,ABIS_BOOK,R_27NeinuChlzrANs,4.75
2021-11-25,7.95,1.0,MT,Puerto Rico Birds: A Folding Pocket Guide to Familiar Species (A Pocket Naturalist Guide),158355985X,ABIS_BOOK,R_2VJ7KiUFzWY3H0p,7.95
2021-11-25,11.95,1.0,MT,"Puerto Rico Map (National Geographic Adventure Map, 3107)",1566955181,ABIS_BOOK,R_2VJ7KiUFzWY3H0p,11.95
2021-02-26,16.99,1.0,MT,Recipes from the World of Tolkien: Inspired by the Legends (Literary Cookbooks),1645174425,ABIS_BOOK,R_2AHiSANbVno9jis,16.99
2019-01-30,14.3,1.0,MT,Requiem for Battleship Yamato (Bluejacket Books),1557505446,ABIS_BOOK,R_DtPfbKjVP7QqLVD,14.3
2018-06-22,27.52,1.0,MT,Restoring a Presence: American Indians and Yellowstone National Park,806135891,ABIS_BOOK,R_27NeinuChlzrANs,27.52
2022-01-05,1.49,1.0,MT,Run Away,1538748460,ABIS_BOOK,R_1gwL8QZGzhV0g3G,1.49
2019-12-14,14.96,1.0,MT,Sibley Birds West: Field Guide to Birds of Western North America,0307957926,ABIS_BOOK,R_2VJ7KiUFzWY3H0p,14.96
2019-10-12,13.4,1.0,MT,Snowmen at Christmas,0803729952,ABIS_BOOK,R_3M0euO2kPnoHrdt,13.4
2019-06-16,20.8,1.0,MT,Statistics for the Behavioral Sciences - Standalone Book,1305504917,ABIS_BOOK,R_2AHiSANbVno9jis,20.8
2020-08-19,37.95,1.0,MT,Taking Action: Implementing Effective Mathematics Teaching Practices in Grades 9-12,0873539761,ABIS_BOOK,R_2VJ7KiUFzWY3H0p,37.95
2019-12-29,17.8,1.0,MT,Tanned Leather Hand-Made Bags: Ultimate Techniques,764356127,ABIS_BOOK,R_2w6Kv77UCoeyLbP,17.8
2021-10-12,16.0,1.0,MT,Tasting Beer: An Insider's Guide to the World's Greatest Drink,1603420894,ABIS_BOOK,R_2VJ7KiUFzWY3H0p,16.0
2021-11-25,12.99,1.0,MT,Taíno Tales: The Secret of the Hummingbird (Taino Tales),1734212942,ABIS_BOOK,R_2VJ7KiUFzWY3H0p,12.99
2020-07-14,23.4,1.0,MT,The Answer Is . . .: Reflections on My Life,1982157992,ABIS_BOOK,R_2us4qPSxiD4clPq,23.4
2019-01-30,24.95,1.0,MT,The Autobiography of Yukichi Fukuzawa,023113987X,ABIS_BOOK,R_DtPfbKjVP7QqLVD,24.95
2018-05-21,13.59,1.0,MT,"The Big Book of Makerspace Projects: Inspiring Makers to Experiment, Create, and Learn",1259644251,ABIS_BOOK,R_2VJ7KiUFzWY3H0p,13.59
2018-09-19,65.51,1.0,MT,"The Complete Film Production Handbook, Fourth Edition (American Film Market Presents)",024081150X,ABIS_BOOK,R_DtPfbKjVP7QqLVD,65.51
2022-07-27,14.65,1.0,MT,The Complete Idiot's Guide to Photography Essentials,1592577520,ABIS_BOOK,R_2VJ7KiUFzWY3H0p,14.65
2019-12-23,24.99,1.0,MT,The Crazy Rich Asians Trilogy Box Set,0525566651,ABIS_BOOK,R_2us4qPSxiD4clPq,24.99
2019-10-18,26.95,1.0,MT,The Dancing Universe: From Creation Myths to the Big Bang (Understanding Science and Technology),158465466X,ABIS_BOOK,R_2w6Kv77UCoeyLbP,26.95
2018-01-23,18.39,1.0,MT,The Film Director's Intuition: Script Analysis and Rehearsal Techniques,941188787,ABIS_BOOK,R_DtPfbKjVP7QqLVD,18.39
2020-08-26,14.99,1.0,MT,The Leatherworking Handbook: A Practical Illustrated Sourcebook of Techniques and Projects,1844034747,ABIS_BOOK,R_2w6Kv77UCoeyLbP,14.99
2020-08-14,13.59,1.0,MT,"The Lighter Step-By-Step Instant Pot Cookbook: Easy Recipes for a Slimmer, Healthier You―With Photographs of Every Step (Step-by-Step Instant Pot Cookbooks)",031670637X,ABIS_BOOK,R_2w6Kv77UCoeyLbP,13.59
2019-09-15,16.03,1.0,MT,The MindUP Curriculum: Grades PreK2: Brain-Focused Strategies for Learningand Living,0545267129,ABIS_BOOK,R_3M0euO2kPnoHrdt,16.03
2019-10-05,12.95,1.0,MT,"The Mindful Dragon: A Dragon Book about Mindfulness. Teach Your Dragon To Be Mindful. A Cute Children Story to Teach Kids about Mindfulness, Focus and Peace. (My Dragon Books)",1948040107,ABIS_BOOK,R_3M0euO2kPnoHrdt,12.95
2019-08-16,13.44,1.0,MT,The Mutt: How to Skateboard and Not Kill Yourself,0060556196,ABIS_BOOK,R_2us4qPSxiD4clPq,13.44
2019-07-30,6.4,1.0,MT,The Pout-Pout Fish Goes to School (A Pout-Pout Fish Adventure),0374308527,ABIS_BOOK,R_3M0euO2kPnoHrdt,6.4
2021-03-13,21.21,1.0,MT,The Priory of the Orange Tree (The Roots of Chaos),1635570298,ABIS_BOOK,R_2AHiSANbVno9jis,21.21
2018-06-03,12.89,1.0,MT,The Rainbow Fish,1558580093,ABIS_BOOK,R_3g1vpqtwzgBUs93,12.89
2018-12-17,7.99,1.0,MT,"The Selection (The Selection, 1)",0062059947,ABIS_BOOK,R_1TvhpEMhVBwUasN,7.99
2019-12-17,22.01,1.0,MT,The Selection 5-Book Box Set: The Complete Series,0062651633,ABIS_BOOK,R_1TvhpEMhVBwUasN,22.01
2019-12-17,9.49,1.0,MT,The Selection Coloring Book,006264114X,ABIS_BOOK,R_1TvhpEMhVBwUasN,9.49
2021-12-05,17.59,1.0,MT,The Simple Comforts Step-by-Step Instant Pot Cookbook: The Easiest and Most Satisfying Comfort Food Ever ― With Photographs of Every Step (Step-by-Step Instant Pot Cookbooks),316337455,ABIS_BOOK,R_2w6Kv77UCoeyLbP,17.59
2019-11-23,15.99,1.0,MT,The Step-by-Step Instant Pot Cookbook: 100 Simple Recipes for Spectacular Results -- with Photographs of Every Step (Step-by-Step Instant Pot Cookbooks),316460834,ABIS_BOOK,R_2w6Kv77UCoeyLbP,15.99
2019-11-07,15.99,1.0,MT,The Step-by-Step Instant Pot Cookbook: 100 Simple Recipes for Spectacular Results -- with Photographs of Every Step (Step-by-Step Instant Pot Cookbooks),316460834,ABIS_BOOK,R_2w6Kv77UCoeyLbP,15.99
2020-09-30,12.5,1.0,MT,The Subtle Art of Not Giving a F*ck: A Counterintuitive Approach to Living a Good Life,0062457713,ABIS_BOOK,R_1gwL8QZGzhV0g3G,12.5
2020-01-14,6.99,1.0,MT,"The Ultimate Guide to Modern Calligraphy & Hand Lettering for Beginners: Learn to Letter: A Hand Lettering Workbook with Tips, Techniques, Practice Pages, and Projects",1646081498,ABIS_BOOK,R_3M0euO2kPnoHrdt,6.99
2020-09-04,29.99,1.0,MT,"The Unofficial Legend Of Zelda Cookbook: From Monstrous to Dubious to Delicious, 195 Heroic Recipes to Restore your Hearts!",173447310X,ABIS_BOOK,R_2VJ7KiUFzWY3H0p,29.99
2019-09-15,9.69,1.0,MT,TinkerActive Workbooks: Kindergarten Math,125030721X,ABIS_BOOK,R_3M0euO2kPnoHrdt,9.69
2019-09-15,7.49,1.0,MT,TinkerActive Workbooks: Kindergarten Science,1250307244,ABIS_BOOK,R_3M0euO2kPnoHrdt,7.49
2021-04-19,7.19,1.0,MT,To Kill a Mockingbird,0060935464,ABIS_BOOK,R_1TvhpEMhVBwUasN,7.19
2021-11-14,14.74,1.0,MT,"Twist Me Pretty Braids: 45 Step-by-Step Tutorials for Beautiful, Everyday Hairstyles",1612437281,ABIS_BOOK,R_2VJ7KiUFzWY3H0p,14.74
2020-11-27,16.49,1.0,MT,Untamed,1984801252,ABIS_BOOK,R_2AHiSANbVno9jis,16.49
2019-02-14,11.52,1.0,MT,Vertigo,811226166,ABIS_BOOK,R_DtPfbKjVP7QqLVD,11.52
2022-01-23,13.8,1.0,MT,Watercolor Success in Four Steps: 150 Skill-Building Projects to Paint (Design Originals) Beginner-Friendly Step-by-Step Instructions & Techniques to Create Beautiful Paintings as Easy as 1-2-3-4,1497204496,ABIS_BOOK,R_2w6Kv77UCoeyLbP,13.8
2018-01-23,15.28,1.0,MT,What Every Body Is Saying: An Ex-FBI Agent's Guide to Speed-Reading People,61438294,ABIS_BOOK,R_DtPfbKjVP7QqLVD,15.28
2020-11-27,9.59,2.0,MT,Wreck This Journal: Now in Color,0143131664,ABIS_BOOK,R_2AHiSANbVno9jis,19.18
2019-01-10,11.99,1.0,MT,"You Are a Badass Every Day: How to Keep Your Motivation Strong, Your Vibe High, and Your Quest for Transformation Unstoppable",525561641,ABIS_BOOK,R_2w6Kv77UCoeyLbP,11.99
2019-01-10,9.6,1.0,MT,You Are a Badass: How to Stop Doubting Your Greatness and Start Living an Awesome Life,762447699,ABIS_BOOK,R_2w6Kv77UCoeyLbP,9.6
2020-12-11,5.78,1.0,MT,Death Becomes Her,0783225482,ABIS_DVD,R_1gwL8QZGzhV0g3G,5.78
2019-12-02,11.99,1.0,MT,Awakening,B07SXQR6PP,ABIS_MUSIC,R_3M0euO2kPnoHrdt,11.99
2020-11-28,19.99,1.0,MT,Best Of The Kingston Trio,B0776K7CM3,ABIS_MUSIC,R_2VJ7KiUFzWY3H0p,19.99
2019-12-29,3.79,1.0,MT,Blind,B0012GMVA8,ABIS_MUSIC,R_3M0euO2kPnoHrdt,3.79
2019-12-29,9.5,1.0,MT,Blood Mountain,B000GPI2EK,ABIS_MUSIC,R_3M0euO2kPnoHrdt,9.5
2019-12-29,8.29,1.0,MT,Cause of Death,B000000H40,ABIS_MUSIC,R_3M0euO2kPnoHrdt,8.29
2019-12-29,5.89,1.0,MT,Cold Dark Place,B074TZZLBD,ABIS_MUSIC,R_3M0euO2kPnoHrdt,5.89
2019-12-29,8.96,1.0,MT,Enslaved,B006YTYIXG,ABIS_MUSIC,R_3M0euO2kPnoHrdt,8.96
2019-12-29,8.64,1.0,MT,For All Kings,B018RLBAFM,ABIS_MUSIC,R_3M0euO2kPnoHrdt,8.64
2021-03-05,26.52,1.0,MT,Gold: Greatest Hits,B00JSRXE3G,ABIS_MUSIC,R_2VJ7KiUFzWY3H0p,26.52
2019-12-29,9.14,1.0,MT,Hardwired...To Self-Destruct,B01KP8CSWE,ABIS_MUSIC,R_3M0euO2kPnoHrdt,9.14
2020-11-28,18.89,1.0,MT,Hits Out Of Hell,B07HBPS1R8,ABIS_MUSIC,R_2VJ7KiUFzWY3H0p,18.89
2021-12-31,26.76,1.0,MT,Hoax,B07N94L9R7,ABIS_MUSIC,R_XYeZSVkzBQBQtBD,26.76
2019-12-02,11.64,1.0,MT,No Mercy In This Land,B0794SPYVD,ABIS_MUSIC,R_3M0euO2kPnoHrdt,11.64
2019-12-02,10.34,1.0,MT,Rainier Fog,B07DY2M96G,ABIS_MUSIC,R_3M0euO2kPnoHrdt,10.34
2019-12-29,6.4,1.0,MT,Revelations,B000GW8B08,ABIS_MUSIC,R_3M0euO2kPnoHrdt,6.4
2019-12-29,9.96,1.0,MT,Ride The Lightning Remastered,B01BUX7Z6M,ABIS_MUSIC,R_3M0euO2kPnoHrdt,9.96
2019-12-02,9.97,1.0,MT,Stone Temple Pilots,B079B8RHQJ,ABIS_MUSIC,R_3M0euO2kPnoHrdt,9.97
2019-12-02,9.99,1.0,MT,Testify,B000BGH0OC,ABIS_MUSIC,R_3M0euO2kPnoHrdt,9.99
2019-12-29,9.82,1.0,MT,The Crusade,B000HXDEUI,ABIS_MUSIC,R_3M0euO2kPnoHrdt,9.82
2019-12-29,5.59,1.0,MT,The Duke EP,B01M30A73Y,ABIS_MUSIC,R_3M0euO2kPnoHrdt,5.59
2019-12-29,10.25,1.0,MT,The Sin and the Sentence,B0752ZWPJC,ABIS_MUSIC,R_3M0euO2kPnoHrdt,10.25
2020-11-28,28.16,1.0,MT,Tom Petty & the Heartbreakers - Greatest Hits,B01GGJV5VQ,ABIS_MUSIC,R_2VJ7KiUFzWY3H0p,28.16
2019-12-29,3.79,1.0,MT,Wiseblood,B0012GMYOQ,ABIS_MUSIC,R_3M0euO2kPnoHrdt,3.79
2022-01-09,23.99,1.0,MT,You Signed Up For This,B096TTSXLY,ABIS_MUSIC,R_XYeZSVkzBQBQtBD,23.99
2021-10-18,18.3,1.0,MT,"NOVUS-PK1-8 | Plastic Clean & Shine #1, Fine Scratch Remover #2, Heavy Scratch Remover #3 and Polish Mates Pack | 8 Ounce Bottles",B002UCYRZU,ABRASIVES,R_2QQl58nFfrZayxf,18.3
2020-05-01,3.68,1.0,MT,"Permatex 80037 Valve Grinding Compound, 3 oz.",B000HBM80M,ABRASIVES,R_1TvhpEMhVBwUasN,3.68
2022-07-31,5.6,1.0,MT,"Amazon Basics Stainless Steel and Brass Mini Wire Brush, 12-Pack",B08XN8HNQY,ABRASIVE_BRUSH,R_1TvhpEMhVBwUasN,5.6
2021-12-05,15.99,1.0,MT,Wander Agio Womens Warm Long Shawl Winter Wraps Large Scarves Knit Cashmere Feel Plaid Triangle Scarf,B09CGJP543,ACCESSORY,R_2w6Kv77UCoeyLbP,15.99
2021-08-28,10.99,1.0,MT,Womens Removable Smart Cups Bra Replacement Inserts Liner Pads 3 Pairs In Set,B01I6OH28Y,ACCESSORY,R_2w6Kv77UCoeyLbP,10.99
2022-02-02,13.99,1.0,MT,180 Pack Square Double Sided Foam Tape Strong Pad Mounting Adhesive Tape (Black),B09MLRHC8M,ADHESIVE_TAPES,R_2us4qPSxiD4clPq,13.99
2020-12-21,2.63,1.0,MT,"3M C314-BLK Washi Tape, 0.59-Inch x 393-Inch, Black",B00F9LDSKO,ADHESIVE_TAPES,R_1TvhpEMhVBwUasN,2.63
2021-09-14,10.25,1.0,MT,"3M High Temperature Flue Tape, High Heat Sealing Tape up to 600 degrees, 15-Foot Roll",B00004Z4DS,ADHESIVE_TAPES,R_2QQl58nFfrZayxf,10.25
2021-01-25,13.49,1.0,MT,Craftopia Magnetic Sheet | 20 x 25 cm | Pack of 10 | Magnet Sheets with Adhesive for Craft! - Flexible Peel and Stick Self Adhesive for Craft Photos Stamp Dies and More – Premium Quality,B071L97W57,ADHESIVE_TAPES,R_2VJ7KiUFzWY3H0p,13.49
2021-06-28,12.94,1.0,MT,"Gorilla Waterproof Patch & Seal Tape 4"" x 10' White, (Pack of 1)",B08126M2R4,ADHESIVE_TAPES,R_1gwL8QZGzhV0g3G,12.94
2022-08-28,29.99,1.0,MT,JH Best Crafts Adhesive Magnetic Sheets | Flexible Magnet with Adhesive Backing | 8 x 10 Inch Magnets for Crafts and Pictures | Cut to Any Size | Pack of 30,B07T4H2CWR,ADHESIVE_TAPES,R_2VJ7KiUFzWY3H0p,29.99
2020-12-21,4.99,1.0,MT,"Scotch Expressions Washi Tape Multi Pack, 5 rolls/pk, Thin Foil Collection (C1017-5-P1)",B07C2Q931K,ADHESIVE_TAPES,R_1TvhpEMhVBwUasN,4.99
2022-07-30,169.99,1.0,MT,"BOSTITCH Air Compressor Kit, Oil-Free, 6 Gallon, 150 PSI (BTFP02012-WPK)",B06Y2LQ5QJ,AIR_COMPRESSOR,R_1TvhpEMhVBwUasN,169.99
2019-04-02,62.99,1.0,MT,"Air Fryer, SincaLong Oven Oilless Cooker with 7 Cooking Presets, Large Capacity 5.7Qt Electric Air Fryer with LED Digital Touchscreen, Black/Beige",B07BQNS6HC,AIR_FRYER,R_2VJ7KiUFzWY3H0p,62.99
2019-12-19,99.98,1.0,MT,"COSORI Pro Air Fryer Oven Combo, 5.8QT Max Xl Large Cooker with 300+ Recipes, One-Touch Screen with 11 Presets and Shake Reminder, Nonstick and Dishwasher-Safe Detachable Square Basket, Black",B07GJBBGHG,AIR_FRYER,R_2us4qPSxiD4clPq,99.98
2020-01-07,79.95,1.0,MT,"Instant Pot Air Fryer Lid 6 in 1, No Pressure Cooking Functionality, 6 Qt, 1500 W,Black",B07VF7J5VQ,AIR_FRYER,R_2w6Kv77UCoeyLbP,79.95
2022-05-04,15.99,1.0,MT,"BOLTHO Foot Pump, Portable Floor Bike Pump with Accurate Pressure Gauge & Smart Valves, 100PSI Air Pump for Motorcycles, Bicycles, Cars, Balls and Other Inflatables",B09R717W2G,AIR_PUMP,R_2QQl58nFfrZayxf,15.99
2022-06-23,8.99,1.0,MT,Intex Quick-Fill Air Pump Series,B07F3FTCXB,AIR_PUMP,R_2QQl58nFfrZayxf,8.99
2020-04-18,17.99,1.0,MT,"Rechargeable Air Pump, AGPTEK Electric Air Pump Quick-Fill Inflator & Deflator with 3 Nozzles, Lightweight & Portable Rechargeable Air Pump Perfect for Air Beds, Air Mattresses, Pool Toys & Inflatable",B07QBMQSMS,AIR_PUMP,R_1gwL8QZGzhV0g3G,17.99
2021-09-14,9.99,1.0,MT,"WEY&FLY High Output Hand Pump Double Quick Air Pump for Mattress Pump Universal Manual Air Pump for Inflatables Double Quick Air Volume Heavy Duty PP Plastic for Mattress Pump,Tubing,Ball, etc(8108)",B07FNRRYG8,AIR_PUMP,R_2QQl58nFfrZayxf,9.99
2019-01-26,249.99,1.0,MT,"BLUEAIR Air Purifier Large Room, Air Cleaner for Dust Pet Dander Smoke Mold Pollen Bacteria Allergen, Odor Removal, for Home Bedroom Living Room, Washable Pre Filter, HEPASilent, Blue 211+ (Non-Auto)",B073WJL99W,AIR_PURIFIER,R_2QQl58nFfrZayxf,249.99
2023-01-20,79.99,1.0,MT,"Amazon Halo View fitness tracker, with color display for at-a-glance access to heart rate, activity, and sleep tracking – Active Black – Medium/Large",B09S8K7191,AMAZON_DEVICE,R_1TvhpEMhVBwUasN,79.99
2021-06-22,149.99,1.0,MT,"Amazon Fire HD 10 tablet, 10.1"", 1080p Full HD, 32 GB, latest model (2021 release), Black",B08BX7FV5L,AMAZON_TABLET,R_1TvhpEMhVBwUasN,149.99
2019-11-29,99.99,1.0,MT,"Fire HD 10 Tablet (10.1"" 1080p full HD display, 32 GB) – Black (2019 Release)",B07K1RZWMC,AMAZON_TABLET,R_1TvhpEMhVBwUasN,99.99
2019-11-24,99.99,1.0,MT,"Fire HD 10 Tablet (10.1"" 1080p full HD display, 32 GB) – Twilight Blue (2019 Release)",B07KD6YDKC,AMAZON_TABLET,R_3M0euO2kPnoHrdt,99.99
2018-10-27,59.99,1.0,MT,"Fire HD 8 Tablet (8"" HD Display, 16 GB) - Black (Previous Generation - 8th)",B0794RHPZD,AMAZON_TABLET,R_27NeinuChlzrANs,59.99
2019-11-24,29.99,1.0,MT,3-Year Accident Protection Plan for All Fire HD 10 (9th generation),B07PD868CR,AMAZON_TABLET_ACCESSORY,R_3M0euO2kPnoHrdt,29.99
2018-10-27,15.99,1.0,MT,Ztotop iPad Pro 12.9 2018 Released 3rd Gen Magnetic Case with Auto Wake Sleep and Multiple Viewing Angles Dark Gray Case for 3rd Generation iPad Pro,B07HMP2Q64,AMAZON_TABLET_ACCESSORY,R_27NeinuChlzrANs,15.99
2022-01-04,13.99,2.0,MT,"BSEEN LED Dog Collar, USB Rechargeable, Glowing pet Dog Collar for Night Safety, Fashion Light up Collar for Small Medium Large Dogs (Candy Pink)",B07CSM59JV,ANIMAL_COLLAR,R_1gwL8QZGzhV0g3G,27.98
2019-09-15,9.99,1.0,MT,"Blueberry Pet Essentials 21 Colors Classic Dog Collar, Dark Orchid, Large, Neck 18""-26"", Nylon Collars for Dogs",B00HRQAQJU,ANIMAL_COLLAR,R_3M0euO2kPnoHrdt,9.99
2022-08-20,5.99,1.0,MT,"CHUKCHI 2 Pack/Set Cat Collar Breakaway with Cute Bow Tie Bell for Most Cats and Some Puppies, Adjustable from 7.8-10.5 Inch",B08DD2HYQF,ANIMAL_COLLAR,R_2VJ7KiUFzWY3H0p,5.99
2019-09-15,24.95,1.0,MT,"Service Dog Vest with Hook and Loop Straps and Handle - Harness is Available in 8 Sizes from XXXS to XXL - Service Dog Harness Features Reflective Patch and Comfortable Mesh Design (Blue, Medium)",B00RGSV4OA,ANIMAL_HARNESS,R_3M0euO2kPnoHrdt,24.95
