2022-04-09,16.65,1.0,MT,OTTERBOX Defender Series SCREENLESS Edition Case for Google Pixel 3 XL - Retail Packaging - Black,B07HHMLVM9,CELLULAR_PHONE_CASE,R_3lzv4o9axMfFsE2,16.65
2020-01-05,31.01,1.0,MT,OTTERBOX SYMMETRY CLEAR SERIES Case for iPhone 11 Pro Max - CLEAR,B07WL6QHCQ,CELLULAR_PHONE_CASE,R_3M0euO2kPnoHrdt,31.01
2018-12-04,7.99,1.0,MT,"Obbii Cell Phone Wallet Dual Pocket Leather Case Pocket Nature Blue Purple Marble Card Holder,Stretchy Credit Card Holder for Back of for iPhone and All Smartphones USD$799USD$7.99",B07KLXFTHR,CELLULAR_PHONE_CASE,R_2AHiSANbVno9jis,7.99
2019-02-17,14.17,1.0,MT,OtterBox COMMUTER SERIES Case for Samsung Galaxy S7 Edge - Retail Packaging - WHETSTONE WAY (WHETSTONE BLUE/TEMPEST BLUE),B00Z7TFRG6,CELLULAR_PHONE_CASE,R_2w6Kv77UCoeyLbP,14.17
2018-09-20,24.35,1.0,MT,OtterBox DEFENDER SERIES Case for iPhone SE (3rd and 2nd gen) and iPhone 8/7 - Frustration Free Packaging - BLACK,B01K6PAS50,CELLULAR_PHONE_CASE,R_2VJ7KiUFzWY3H0p,24.35
2022-03-27,9.95,1.0,MT,OtterBox Symmetry Series Case for iPhone Xs & iPhone X - Non-Retail Packaging - Gold Lace,B07NVSRYML,CELLULAR_PHONE_CASE,R_1TvhpEMhVBwUasN,9.95
2020-03-06,7.96,1.0,MT,OtterBox Symmetry Series Slim Case for Samsung Galaxy S7 EDGE - Non-Retail Packaging - Boardwalk,B07NWSVD9W,CELLULAR_PHONE_CASE,R_2w6Kv77UCoeyLbP,7.96
2020-03-06,9.97,1.0,MT,OtterBox Symmetry Series Slim Case for Samsung Galaxy S7 EDGE- Non-Retail Packaging - Black Crystal,B07MM2M2GS,CELLULAR_PHONE_CASE,R_2w6Kv77UCoeyLbP,9.97
2019-02-17,9.99,1.0,MT,"RabeMall Samsung Galaxy S7 Edge Case Unique Pretty Flowers for Girls/Women Anti-Fingerprint Three Layer High Impact Resistant Hybrid Shockproof Protective Cover,Floral Rose Gold",B078M8ZXY1,CELLULAR_PHONE_CASE,R_2w6Kv77UCoeyLbP,9.99
2020-12-17,3.99,1.0,MT,"Samsung Galaxy A20/A30 Case,W/[2-Pack]Tempered Glass Screen Protector Dual Layers Heavy Duty Protective Hard PC Football Lines Design Back Soft TPU Rubber Armor Defender Shockproof Phone Case.(Black)",B07VG1WPQD,CELLULAR_PHONE_CASE,R_1TvhpEMhVBwUasN,3.99
2018-12-18,11.99,1.0,MT,Spigen Thin Fit Designed for Google Pixel 2 XL Case (2017) - Black,B07475C1VT,CELLULAR_PHONE_CASE,R_27NeinuChlzrANs,11.99
2019-03-19,8.49,1.0,MT,TJS Case for LG Aristo 2/Aristo 2 Plus/Aristo 3/Aristo 3 Plus/Tribute Dynasty/Tribute Empire/Fortune 2/Rebel 3 LTE [Full Coverage Tempered Glass Screen Protector] Hybrid Armor Marble Phone (White),B078W4L4L5,CELLULAR_PHONE_CASE,R_1TvhpEMhVBwUasN,8.49
2020-05-13,11.99,1.0,MT,"UEEBAI Case for iPhone SE 2022 5G/iPhone 7/iPhone 8/iPhone SE 2020, Luxury PU Leather Case [Magnetic] [Card Slots] Stand Durable Shockproof Case Back Wallet Flip Cover for iPhone SE3/SE2 - Grey & Pink",B087GCHHLG,CELLULAR_PHONE_CASE,R_1gwL8QZGzhV0g3G,11.99
2021-07-11,12.99,1.0,MT,"iPhone 12 Pro Waterproof Case 6.1 inch, Fansteck Built-in Magnet for Magsafe Charger & Portable Kickstand, IP68 Full Body Waterproof Shockproof Dustproof Snowproof Case for iPhone 12 Pro (Black/White)",B081W1VDF7,CELLULAR_PHONE_CASE,R_1gwL8QZGzhV0g3G,12.99
2021-08-29,9.99,1.0,MT,"PopSockets: Phone Grip with Expanding Kickstand, Pop Socket for Phone - Opal",B07P4G93ZB,CELL_PHONE_GRIP,R_1TvhpEMhVBwUasN,9.99
2022-03-27,16.99,1.0,MT,​​​​PopSockets: Phone Grip with Expanding Kickstand: Pop Socket for Phone - Enamel Wild Flowers,B08WVT5DZL,CELL_PHONE_GRIP,R_1TvhpEMhVBwUasN,16.99
2019-02-26,17.96,1.0,MT,Encased Belt Clip Holster Compatible with Otterbox Statement Case - iPhone X (case not Included),B078MY5T22,CELL_PHONE_HOLSTER,R_1TvhpEMhVBwUasN,17.96
2022-09-17,59.95,1.0,MT,OTTERBOX DEFENDER SERIES Case for Pixel 6 - BLACK,B09JYLKM4R,CELL_PHONE_HOLSTER,R_3lzv4o9axMfFsE2,59.95
2018-07-20,32.6,1.0,MT,"Goya Foods Natural Long Grain Brown Rice, 5 Pound (Pack of 8)",B06XBWZGTG,CEREAL,R_3RvWAoKmyrRWhnA,32.6
2018-01-19,14.97,1.0,MT,Stellar Labs 6203-MCM Compact RF Modulator,B008DJT8SU,CE_ACCESSORY,R_2VJ7KiUFzWY3H0p,14.97
2021-04-09,6.49,1.0,MT,HiLetgo 10pcs 18650 Battery Clip 18650 Battery Holder 18650 Batteries Case for 18650 Battery with Connect Lead,B00LSG5BKO,CE_CARRYING_CASE_OR_BAG,R_2QQl58nFfrZayxf,6.49
2019-08-15,69.99,1.0,MT,ALPS Mountaineering King Kong Chair,B077P5X843,CHAIR,R_3M0euO2kPnoHrdt,69.99
2020-08-01,103.99,1.0,MT,FDW Set of 2 Zero Gravity Chairs Lounge Patio Chairs Outdoor Yard Beach (Tan),B01MG7LEHA,CHAIR,R_2w6Kv77UCoeyLbP,103.99
2022-08-25,108.9,1.0,MT,"GTPLAYER Gaming Chair, Computer with Footrest and Lumbar Support Height Adjustable with 360°-Swivel Seat and Headrest for Office or Gaming (White)",B0BBPRZHRX,CHAIR,R_262xe1Uv99c2Nwd,108.9
2021-12-17,34.0,1.0,MT,"OFM Office Chair Mat for Carpet – Computer Desk Chair Mat for Carpeted Floors – Easy Glide Rolling Plastic Floor Mat for Office Chair on Carpet for Work, Home, Gaming with Extended Lip (36” x 48”)",B01N99XMM2,CHAIR_MAT,R_1TvhpEMhVBwUasN,34.0
2019-07-20,27.99,1.0,MT,Charger for Surface Compatible with Surface Pro 4 (Intel Core i5 and Core i7) Surface Pro 3 Surface Go Charge Cord with USB Port (Model 1625 36W 12V 2.58A),B075M938KB,CHARGING_ADAPTER,R_2AHiSANbVno9jis,27.99
2022-09-30,13.99,1.0,MT,"Color Rokk Wireless Charging Pad,Qi-Certified 15W Max Fast Wireless Charger for Google Pixel 6/6 Pro,Samsung Galaxy S22 Ultra/S22+/S21,iPhone 14/13 Pro Max/13 Mini/12(No AC Adapter) (Black)",B09KH78W6N,CHARGING_ADAPTER,R_3lzv4o9axMfFsE2,13.99
2021-12-23,9.99,1.0,MT,D'Addario Accessories PW-CT-9V DC Power Adapter – Pedalboard Power Supply - Minimize Need to Change Batteries on Pedalboard and Devices Requiring 9V – 800mA Max Current – Guitar Pedal Power Supply,B00191WVF6,CHARGING_ADAPTER,R_2us4qPSxiD4clPq,9.99
2022-05-22,30.53,1.0,MT,Dyson New Genuine AC Adapter Charger V8 V7 V6 DC58 DC59 DC61 DC62 SV04 SV05 SV06 Model# 205720-02,B07C93P79K,CHARGING_ADAPTER,R_1TvhpEMhVBwUasN,30.53
2019-03-05,5.99,1.0,MT,LOTUS POWER EC-5 EC5 Cigarette Lighter Socket Adaptor for EC-5 Mini Car Battery Booster EC5 Mini Car Jump Starter,B019IFHLAE,CHARGING_ADAPTER,R_2VJ7KiUFzWY3H0p,5.99
2022-02-14,15.99,1.0,MT,Laptop Ac Adapter Charger for Toshiba Satellite L75D-A7288 PSKNSU-006002; Toshiba Satellite L75D-A7283 PSKNJU-004001; Toshiba Satellite L75D-A7280 PSKNJU-001001,B07D668CD1,CHARGING_ADAPTER,R_3lzv4o9axMfFsE2,15.99
2018-07-20,19.29,1.0,MT,Motorola TurboPower 30 USB-C / Type C Fast Charger - SPN5912A (Retail Packaging) for Moto Z Force,B01L1HK4NI,CHARGING_ADAPTER,R_3RvWAoKmyrRWhnA,19.29
2019-10-21,16.97,1.0,MT,PowerSource UL Listed 26W 7Ft Extra Long AC-Adapter for Samsung-Chromebook-Charger 3 & 2: 500C 500C13 Xe500c13 501C PA-1250-98 Xe501c13 Xe500c12 Xe503c12 11.6-inch Laptop Power-Supply Cord 12V,B06XK9FC24,CHARGING_ADAPTER,R_27NeinuChlzrANs,16.97
2019-09-10,12.9,2.0,MT,Pwr Charger for Booster PAC ES5000 ES2500 J900: UL Listed Extra Long 6.7 Ft Cord AC Adapter ES6000 ES1224 ESA214 ESA218 ESA22 Jump Starter Power Supply Replacement Charger,B07667N5SD,CHARGING_ADAPTER,R_2VJ7KiUFzWY3H0p,25.8
2021-02-26,17.99,1.0,MT,USB Charger USB Charging Station with Rapid Charging Auto Detect Technology Safety Guaranteed 10-Port Family-Sized Smart USB Ports for Multiple Devices Smart Phone Tablet Laptop Computer,B07XXDS86V,CHARGING_ADAPTER,R_3lzv4o9axMfFsE2,17.99
2021-05-02,10.96,1.0,MT,"USB Wall Charger, KENHAO 3-Pack 2.1A/5V Dual Port USB Plug Power Adapter Charging Block Cube Charger Brick Box for iPhone 13/12/11/XR/XS/X/8/7/6 Plus 5/SE/4, iPad, Samsung, Moto, Android Phone",B076NQM7GM,CHARGING_ADAPTER,R_2w6Kv77UCoeyLbP,10.96
2018-01-16,79.99,1.0,MT,Xbox One Kinect Sensor,B00INAX3Q2,CHARGING_ADAPTER,R_DtPfbKjVP7QqLVD,79.99
2021-06-16,8.99,1.0,MT,120 Pieces Stainless Steel Pendant Tray Kit Including 60 Pieces Round Frame Tray Blank Pendant Bases and 60 Pieces Clear Glass Cabochons for DIY Jewelry Making (12mm),B08XK7TQSX,CHARM,R_2QQl58nFfrZayxf,8.99
2020-01-03,12.77,1.0,MT,"Glarks 70Pcs Oval Pendant Set, 35Pcs 5 Colors Pendant Trays and 35 Pieces Bright Glass Cabochon Dome Tiles for Bracelet Necklace Crafting DIY Jewelry Gift Making",B07HHZ4RZL,CHARM,R_27NeinuChlzrANs,12.77
2021-06-16,10.99,1.0,MT,"HAUTOCO 60 Pieces Glass Dome Cabochons Clear Round Cabochons Tiles, Non-calibrated Round 1 inch/25mm for Cameo Pendants Photo Jewelry Necklaces",B07D3S5XF8,CHARM,R_2QQl58nFfrZayxf,10.99
2021-10-10,14.49,1.0,MT,PH PandaHall 50pcs 10x25mm Rectangle Trays Pendant Stainless Steel Pendant Cabochon Settings Bezel Pendant Blanks Cameo Bezel Cabochon Blanks Bezel Trays for Jewelry Making DIY Findings,B07KKFWFHN,CHARM,R_2QQl58nFfrZayxf,14.49
2021-10-26,9.99,1.0,MT,"200 Strips - Water Hardness Test Strips 0-425 ppm (mg/L) (Mega Pack) - Hard Water Test Kit - Total Hardness Test - Water Hardness Test Kit for Water Softener, Drinking Water, Pool, Spa and More",B08186V45M,CHEMICAL_TEST_STRIP,R_1TvhpEMhVBwUasN,9.99
2021-12-21,10.97,1.0,MT,"Premium Water Hardness Test Kit | Fast and Accurate Hard Water Quality Testing Strips for Water Softener Dishwasher Well Spa Pool, etc. | 0-425 ppm | Calcium and Magnesium Total Hardness (150 Strips)",B08D8KFPV8,CHEMICAL_TEST_STRIP,R_1TvhpEMhVBwUasN,10.97
2020-04-12,13.99,1.0,MT,"CrazyOutlet HERSHEY'S KISSES Milk Chocolate Filled Caramel, Gold Wrapping Candy, Bulk Pack 2 Pounds",B07YM13QQW,CHOCOLATE_CANDY,R_3M0euO2kPnoHrdt,13.99
2020-04-24,13.99,1.0,MT,"CrazyOutlet HERSHEY'S KISSES Milk Chocolate Filled Caramel, Gold Wrapping Candy, Bulk Pack 2 Pounds",B07YM13QQW,CHOCOLATE_CANDY,R_3M0euO2kPnoHrdt,13.99
2021-03-26,6.39,1.0,MT,Harry Potter Milk Chocolate Frog with Collectible Wizard Trading Card .55oz,B00600N5UQ,CHOCOLATE_CANDY,R_3lzv4o9axMfFsE2,6.39
2020-04-12,8.99,1.0,MT,"M&M'S Milk Chocolate Candy, 38-Ounce Party Size Bag",B07W5B43Z8,CHOCOLATE_CANDY,R_3M0euO2kPnoHrdt,8.99
2020-04-07,22.99,1.0,MT,"REESE'S Milk Chocolate Full Size, Easter Peanut Butter Cups Candy Packs, 1.5 oz (36 Count)",B000IXUK8G,CHOCOLATE_CANDY,R_2w6Kv77UCoeyLbP,22.99
2020-10-12,12.97,1.0,MT,"BISSELL OXYgen BOOST Portable Machine Formula, 32 ounces, 0801",B000RH0JGQ,CLEANING_AGENT,R_2w6Kv77UCoeyLbP,12.97
2020-10-12,13.94,1.0,MT,"Bissell Professional Power Shot Oxy Carpet Spot, 14 Ounces (Pack of 2), 95C9L Stain Remover, 14oz, None, 28 Fl Oz",B0829KMTBF,CLEANING_AGENT,R_2w6Kv77UCoeyLbP,13.94
2020-10-12,9.87,2.0,MT,"Bissell Professional Spot and Stain + Oxy Portable Machine Formula, 32 oz, 1-Pack, 32 Fl Oz",B074FRJR9M,CLEANING_AGENT,R_2w6Kv77UCoeyLbP,19.74
2020-10-07,10.97,2.0,MT,"Bissell Professional Spot and Stain + Oxy Portable Machine Formula, 32 oz, 1-Pack, 32 Fl Oz",B074FRJR9M,CLEANING_AGENT,R_2w6Kv77UCoeyLbP,21.94
2022-03-15,11.99,1.0,MT,"Bissell Professional Spot and Stain + Oxy Portable Machine Formula, 32 oz, 1-Pack, 32 Fl Oz",B074FRJR9M,CLEANING_AGENT,R_1TvhpEMhVBwUasN,11.99
2021-09-11,28.99,1.0,MT,"Bore Tech Eliminator Bore Cleaner, 16 oz",B007X0PPXW,CLEANING_AGENT,R_2VJ7KiUFzWY3H0p,28.99
2019-09-01,7.02,1.0,MT,"Bottle Bright (12 Tablets) - Cleaning Tablets for Water Bottle, Container & Hydration Pack - Fresh and Clear - Safe and Free of Harmful Ingredients",B06XYCVDB9,CLEANING_AGENT,R_2AHiSANbVno9jis,7.02
2019-11-15,7.57,1.0,MT,"Clorox Toilet Wand Disinfecting Refills, Toilet and Bathroom Cleaning, Toilet Brush Heads, Disposable Wand Heads, Blue Original, 30 Count",B00U2T6SQ4,CLEANING_AGENT,R_1TvhpEMhVBwUasN,7.57
2020-04-25,5.46,1.0,MT,"Easy Off Professional Oven & Grill Cleaner Can, Yellow, 1.5 lb, 24 Oz",B000JKCY8M,CLEANING_AGENT,R_2w6Kv77UCoeyLbP,5.46
2020-04-25,9.78,1.0,MT,"Easy-Off Professional Stainless Steel Cleaner & Polish, 17 oz Can, For Grills Ovens & Appliances",B008TV81NK,CLEANING_AGENT,R_2w6Kv77UCoeyLbP,9.78
2022-08-05,11.99,1.0,MT,Shadazzle Natural All Purpose Cleaner and Polish – Eco friendly Multi-purpose Cleaning Product – Cleans & Polishes any washable surface (Lavender),B07CZN87WX,CLEANING_AGENT,R_2w6Kv77UCoeyLbP,11.99
2021-12-30,14.99,2.0,MT,STAR BRITE Utility Scrub Brush - Marine-Grade Heavy-Duty Stiff Bristled Scrubber - Extra Long Flagged Bristles for More Cleaning Power in Hard to Reach Areas,B000SQBR0S,CLEANING_BRUSH,R_2QQl58nFfrZayxf,29.98
2021-04-10,19.99,1.0,MT,"mDesign Plastic Toilet Plunger with Lift & Lock Cover Set, Compact Discreet Freestanding Storage Caddy Holder for Bathroom, Powder Room, Modern Design - Heavy Duty - Hyde Collection, Bronze",B072DXX5LV,CLEANING_BRUSH,R_2w6Kv77UCoeyLbP,19.99
2021-11-13,23.99,4.0,MT,"Quidel QuickVue at-Home OTC COVID-19 Test Kit, Self-Collected Nasal Swab Sample, 10 Minute Rapid Results - Single Kit (Includes 2 Tests, Intended for a Single User)",B093ND7LX4,CLINICAL_DIAGNOSTIC_TESTING_KIT,R_2VJ7KiUFzWY3H0p,95.96
2021-01-05,7.36,1.0,MT,"BronaGrand 100pcs Mini Clear Plastic Utility Paper Clip, Clothespins Clip, Clothes Line Clips,Photo Clips",B01IHT5E06,CLOTHES_PIN,R_1TvhpEMhVBwUasN,7.36
2020-03-31,18.99,1.0,MT,"BINO Stackable 2 Tier Expandable Shoe Rack - 6-12 Pair Shoe Shelf Tower Storage Organizer, Black",B07G8Q4W4X,CLOTHES_RACK,R_2w6Kv77UCoeyLbP,18.99
2021-03-23,33.99,1.0,MT,"Neprock Shoe Slots Organizer, Adjustable Shoe Stacker Storage Space Saver, Double Deck Shoe Rack Holder for Closet Organization (20-Pack)(White)",B07Y9NDL7N,CLOTHES_RACK,R_2w6Kv77UCoeyLbP,33.99
2021-03-19,33.99,1.0,MT,"Neprock Shoe Slots Organizer, Adjustable Shoe Stacker Storage Space Saver, Double Deck Shoe Rack Holder for Closet Organization (20-Pack)(White)",B07Y9NDL7N,CLOTHES_RACK,R_2w6Kv77UCoeyLbP,33.99
2020-10-13,28.08,1.0,MT,"Seville Classics 3-Tier Expandable 24-Pair Shoe Rack Non-Slip Metal Freestanding Closet, Entryway, Bedroom Footwear Organizer, Chrome Poles",B00O4WPYA6,CLOTHES_RACK,R_2w6Kv77UCoeyLbP,28.08
2022-05-04,41.3,1.0,MT,Amazon Essentials Women's Utility Jacket,B08JDGDXW5,COAT,R_2w6Kv77UCoeyLbP,41.3
2022-04-22,42.1,1.0,MT,Amazon Essentials Women's Utility Jacket,B08JDKWR7P,COAT,R_2w6Kv77UCoeyLbP,42.1
2022-12-17,41.99,1.0,MT,COOFANDY Men's Casual Varsity Jacket Vintage Lightweight Suede Bomber Jackets,B0B3JJPDKN,COAT,R_2AHiSANbVno9jis,41.99
2022-06-12,24.99,1.0,MT,"Calvin Klein Women's Zip Front Windbreaker, Twilight, XXL",B09XCDZ3TT,COAT,R_1TvhpEMhVBwUasN,24.99
2022-11-17,59.99,1.0,MT,Carhartt Men's Rain Defender Loose Fit Heavyweight Quarter-Zip Sweatshirt,B00FXPT9EU,COAT,R_2w6Kv77UCoeyLbP,59.99
2022-12-28,89.75,1.0,MT,Carhartt Men's Rain Defender Relaxed Fit Lightweight Insulated Vest,B0B4F3BYBT,COAT,R_2w6Kv77UCoeyLbP,89.75
2018-10-12,170.0,1.0,MT,"Columbia Men's Alpine Action Jacket – Big, Waterproof and Breathable",B07833KGN5,COAT,R_DtPfbKjVP7QqLVD,170.0
2019-10-12,99.0,1.0,MT,Columbia Women's Heavenly Long Vest,B07JCH9WB8,COAT,R_2w6Kv77UCoeyLbP,99.0
2022-09-22,70.42,1.0,MT,Columbia Women's Mix It Around Ii Vest,B076TSD3N4,COAT,R_2w6Kv77UCoeyLbP,70.42
2021-02-01,44.9,1.0,MT,Columbia Womens Saturday Trail™ Full Zip,B0814QJPBK,COAT,R_2w6Kv77UCoeyLbP,44.9
2021-02-02,44.9,1.0,MT,Columbia Womens Saturday Trail™ Full Zip,B0814RRNPD,COAT,R_2w6Kv77UCoeyLbP,44.9
2022-10-20,33.98,1.0,MT,EVALESS Color Block Plaid Shacket Jacket Women Cute V Neck Long Sleeve Button Down Blouses Tops Flannel Shirts Jackets Coats,B0B3HXNMBK,COAT,R_2w6Kv77UCoeyLbP,33.98
2022-10-14,33.98,1.0,MT,EVALESS Color Block Plaid Shacket Jacket Women Cute V Neck Long Sleeve Button Down Blouses Tops Flannel Shirts Jackets Coats,B0B7J33DDQ,COAT,R_2w6Kv77UCoeyLbP,33.98
2021-03-19,14.83,1.0,MT,Fesky Women's Denim Jacket Casual Ripped Button Up Cropped Distressed Jean Jacket Vintage Blue Trucker Jacket Long Sleeve,B07GWGSPZD,COAT,R_1TvhpEMhVBwUasN,14.83
2022-11-12,72.98,1.0,MT,GEMYSE Women's Waterproof Ski Snow Jacket Insulated Winter Windproof Fleece Jacket with Hood,B08Z37W53F,COAT,R_2VJ7KiUFzWY3H0p,72.98
2022-09-28,36.74,1.0,MT,"Portwest Waterproof Rain Jacket, Lightweight",B00KHNAUKK,COAT,R_2QQl58nFfrZayxf,36.74
2019-10-05,55.13,1.0,MT,Roaman's Women's Plus Size Classic-Length Puffer Jacket With Hood Winter Coat,B07TNT6YNK,COAT,R_3M0euO2kPnoHrdt,55.13
2019-09-15,39.99,1.0,MT,Rokka&Rolla Boys' Reversible Lightweight Puffer Jacket Hooded Water-Resistant Winter Coat,B07TK6WCZ2,COAT,R_3M0euO2kPnoHrdt,39.99
2022-10-06,52.12,1.0,MT,"Dunkin' Decaf Medium Roast Coffee, 88 Keurig K-Cup Pods",B07YF7RMMJ,COFFEE,R_1TvhpEMhVBwUasN,52.12
2022-11-11,14.99,1.0,MT,"Dunkin' Donuts French Vanilla Flavored Coffee K-Cup, 10 ct",B01K3S5MQK,COFFEE,R_2w6Kv77UCoeyLbP,14.99
2019-04-26,21.0,1.0,MT,"Puroast Low Acid Coffee Ground House Blend, Certified Low Acid Coffee - pH above 5.5, Medium Roast, Original, 2.2 LB - Higher Antioxidant - Smooth Taste for Espresso, French Press or Iced Coffee",B004JQR612,COFFEE,R_1TvhpEMhVBwUasN,21.0
2019-04-25,34.49,1.0,MT,"San Francisco Bay Coffee OneCUP Variety Pack 80 Ct Compostable Coffee Pods, K Cup Compatible including Keurig 2.0",B00HS6FQRQ,COFFEE,R_2VJ7KiUFzWY3H0p,34.49
2018-12-09,19.99,1.0,MT,"Mr. Coffee 12-Cup Switch Coffee Maker, Black",B001KBY9I2,COFFEE_MAKER,R_2VJ7KiUFzWY3H0p,19.99
2022-08-06,59.99,1.0,MT,"STARESSO (Upgrade Portable Espresso Machine - Manual Espresso with Rich & Thick Crema, Mini Coffee Maker Using Ground Coffee & Espresso Pods, Portable Espresso Maker for Travel Camping Office Home",B07D53TTFD,COFFEE_MAKER,R_2AHiSANbVno9jis,59.99
2021-11-10,10.1,1.0,MT,"Tops 55700 Fitz-All Replacement Percolator Top, Glass, 13/16-Inch to 1-1/2-Inch (2-Pack)",B07G7922L7,COFFEE_MAKER,R_2QQl58nFfrZayxf,10.1
2019-08-17,26.97,1.0,MT,"LimitlessFunN Teepee Kids Play Tent Bonus Star Lights & Carrying Case for Girls & Boys, Indoor & Outdoor Use (Pink)",B07MCTWT4K,COLLAPSIBLE_PLAY_STRUCTURE,R_1gwL8QZGzhV0g3G,26.97
2019-07-25,16.99,1.0,MT,"Prosper Pet Cat Tunnel - Collapsible 3 Way Quatrefoil Play Toy - Tube Fun for Rabbits, Kittens, and Dogs - Quatrefoil Navy/White",B075MV28CD,COLLAPSIBLE_PLAY_STRUCTURE,R_27NeinuChlzrANs,16.99
2022-09-15,1.95,1.0,MT,Deoxys 68/168 - Celestial Storm - Pokemon Rare Card,B09VX2YBQF,COLLECTIBLE_CARD,R_1ogPEvMIjoSK6eE,1.95
2022-09-15,1.94,1.0,MT,Golurk V - 070/203 - Ultra Rare - Sword & Shield - Evolving Skies,B0B33MZ5M3,COLLECTIBLE_CARD,R_1ogPEvMIjoSK6eE,1.94
2022-09-15,5.77,1.0,MT,Guzzlord GX - 63/111 - Ultra Rare,B0774Z5PBJ,COLLECTIBLE_CARD,R_1ogPEvMIjoSK6eE,5.77
2021-09-01,96.9,1.0,MT,"Dual Chamber Compost Tumbler – Easy-Turn, Fast-Working System – All-Season, Heavy-Duty, High Volume Composter with 2 Sliding Doors - (2 – 18.5gallon /70 Liter)",B0785HCXB5,COMPOST_BIN,R_2us4qPSxiD4clPq,96.9
2018-09-03,1.43,2.0,MT,Allstate 4-Year PC Peripheral Protection Plan ($0-49.99),B008I64TOQ,COMPUTER,R_3RvWAoKmyrRWhnA,2.86
2018-09-03,1.94,1.0,MT,Allstate 4-Year PC Peripheral Protection Plan ($75-99.99),B008I64UF4,COMPUTER,R_3RvWAoKmyrRWhnA,1.94
2018-11-06,1.94,1.0,MT,Allstate 4-Year PC Peripheral Protection Plan ($75-99.99),B008I64UF4,COMPUTER,R_2QQl58nFfrZayxf,1.94
2022-04-15,6.7,1.0,MT,"CoolerCube Thermal Paste, 3g CPU Thermal Compound Paste, Heatsink Paste for All Coolers, CPU, GPU, IC Processor, Carbon Based High Performance, Thermal Interface Material",B09B53Q3QY,COMPUTER_COMPONENT,R_27NeinuChlzrANs,6.7
2022-10-26,22.67,1.0,MT,ASROCKRACK Accessory TPM 2.0 Module TPM Module Infineon SLB9665 13 Pin Model TPM2-SLI,B08MZ6BYGK,COMPUTER_DRIVE_OR_STORAGE,R_3lzv4o9axMfFsE2,22.67
2020-02-19,24.99,1.0,MT,"INLAND Professional 120GB SSD 3D NAND SATA III 6Gb/s 2.5"" 7mm Internal Solid State Drive (120GB)",B076XMH2JT,COMPUTER_DRIVE_OR_STORAGE,R_27NeinuChlzrANs,24.99
2021-11-25,75.99,1.0,MT,"SK hynix Gold S31 1TB SATA Gen3 2.5 inch Internal SSD | SSD 1TB | Up to 560MB/S | Solid State Drive | Compact 2.5"" SSD Form Factor SSD | Internal Solid State Drive | SATA SSD",B07SNHB4RC,COMPUTER_DRIVE_OR_STORAGE,R_3lzv4o9axMfFsE2,75.99
2022-09-05,199.99,1.0,MT,"Samsung 970 EVO Plus SSD 2TB NVMe M.2 Internal Solid State Hard Drive, V-NAND Technology, Storage and Memory Expansion for Gaming, Graphics w/ Heat Control, Max Speed, MZ-V7S2T0B/AM",B07MFZXR1B,COMPUTER_DRIVE_OR_STORAGE,R_1TvhpEMhVBwUasN,199.99
2020-12-16,99.99,1.0,MT,Samsung SSD 860 EVO 1TB 2.5 Inch SATA III Internal SSD (MZ-76E1T0B/AM),B078DPCY3T,COMPUTER_DRIVE_OR_STORAGE,R_1TvhpEMhVBwUasN,99.99
2018-10-04,55.99,1.0,MT,Samsung SSD 860 EVO 250GB 2.5 Inch SATA III Internal SSD (MZ-76E250B/AM),B07864WMK8,COMPUTER_DRIVE_OR_STORAGE,R_DtPfbKjVP7QqLVD,55.99
2019-04-23,49.99,1.0,MT,"Toshiba Canvio Basics 1TB Portable External Hard Drive USB 3.0, Black - HDTB410XK3AA",B079D359S6,COMPUTER_DRIVE_OR_STORAGE,R_2QQl58nFfrZayxf,49.99
2022-04-21,352.96,1.0,MT,"WD 18TB Elements Desktop External Hard Drive, USB 3.0 external hard drive for plug-and-play storage - WDBWLG0180HBK-NESN",B08KTRBHP1,COMPUTER_DRIVE_OR_STORAGE,R_2QQl58nFfrZayxf,352.96
2019-02-11,64.99,1.0,MT,WD 2TB Black My Passport Portable External Hard Drive - USB 3.0 - WDBS4B0020BBK-WESN,B079V4L9BD,COMPUTER_DRIVE_OR_STORAGE,R_DtPfbKjVP7QqLVD,64.99
2019-04-01,99.94,1.0,MT,WD 4TB Black My Passport Portable External Hard Drive - USB 3.0 - WDBYFT0040BBK-WESN,B01LQQH86A,COMPUTER_DRIVE_OR_STORAGE,R_DtPfbKjVP7QqLVD,99.94
2020-11-02,114.59,1.0,MT,"Intel Core i3-10100 Desktop Processor 4 Cores up to 4.3 GHz  LGA1200 (Intel 400 Series Chipset) 65W, Model Number: BX8070110100",B086MMRW87,COMPUTER_PROCESSOR,R_3lzv4o9axMfFsE2,114.59
2020-04-24,13.99,1.0,MT,Molina Vainilla Mexican Vanilla Blend Vanillin Extract 33.3oz,B01B02F2I6,CONCENTRATED_FLAVORING_SUBSTANCE,R_3M0euO2kPnoHrdt,13.99
2019-07-10,13.99,1.0,MT,Molina Vainilla Mexican Vanilla Blend Vanillin Extract 33.3oz,B01B02F2I6,CONCENTRATED_FLAVORING_SUBSTANCE,R_3M0euO2kPnoHrdt,13.99
2022-05-22,9.85,1.0,MT,"[KEWPIE] Japanese Mayonnaise, Excellent Additive, Rich and Creamy Umami Taste, Made In Japan, 500g (Pack of 1)",B07T1F6BTG,CONDIMENT,R_2us4qPSxiD4clPq,9.85
2019-07-20,15.99,1.0,MT,"BIOLAGE Advanced Fiber Strong Conditioner | Detangles & Reinforces Hair Strength, Moisture & Elasticity | For Fragile, Damaged Hair",B00DG0AXKI,CONDITIONER,R_2AHiSANbVno9jis,15.99
2020-07-23,34.57,2.0,MT,Davines OI All in One Milk | Hair Milk Spray | Powerful Hair Detangler + Heat Protection | Smoothes Frizzy Hair,B00CLIC7E6,CONDITIONER,R_3M0euO2kPnoHrdt,69.14
2020-03-22,4.99,1.0,MT,ASURION 3 Year Portable Electronic Accident Protection Plan with Tech Support $30-39.99,B082TR27NZ,CONSUMER_ELECTRONICS,R_3M0euO2kPnoHrdt,4.99
2020-03-31,33.99,1.0,MT,ASURION 4 Year Television Protection Plan ($250 - $299.99),B07PBYK827,CONSUMER_ELECTRONICS,R_2QQl58nFfrZayxf,33.99
2022-01-27,6.89,1.0,MT,"DAELMANS Stroopwafels, Dutch Waffles Soft Toasted, Caramel, Office Snack, Kosher Dairy, Authentic Made In Holland, 8 Stroopwafels Per Box, 1 Box, 8.11oz",B00IGHH048,COOKIE,R_3lzv4o9axMfFsE2,6.89
2021-06-01,5.49,1.0,MT,"11 Piece Stainless Steel Round Cookie Cutter Two Sided Round Cookie Cutters Set, Biscuit Plain Edge Round Pastry Donut Doughnut Cutters in Graduated Sizes",B08GWP8LXR,COOKIE_CUTTER,R_2QQl58nFfrZayxf,5.49
2021-12-21,6.99,1.0,MT,"Ann Clark Cookie Cutters Teardrop Bird Cookie Cutter, 3.25""",B00Y1EMGL2,COOKIE_CUTTER,R_2w6Kv77UCoeyLbP,6.99
2021-12-11,6.75,1.0,MT,Montana State 4 Inch Cookie Cutter from The Cookie Cutter Shop – Tin Plated Steel Cookie Cutter,B07J6P275F,COOKIE_CUTTER,R_2w6Kv77UCoeyLbP,6.75
2021-03-12,9.99,1.0,MT,"Set of 5, 2 Packs Silicone Molds Puppy Dog Paw & Bone Shaped 2 in 1 and 3 Packs Stainless Steel Bone Cookie Cutter,for Homemade Treats and Cat Animal Paw Ice Candy Chocolate Baking Mold (Blue&Pink)",B08HXMY5H6,COOKIE_CUTTER,R_1gwL8QZGzhV0g3G,9.99
2022-01-05,11.99,1.0,MT,"Instant Pot Official Springform Pan, 7.5-Inch, Gray",B07WHHTFXC,COOKING_POT,R_2QQl58nFfrZayxf,11.99
2020-09-22,29.45,1.0,MT,"Golberg Twisted Polypropylene Rope – Marine, Nautical",B07HJCNLBT,CORD_ROPE,R_3M0euO2kPnoHrdt,29.45
2019-07-10,7.99,1.0,MT,"Obecome Cherry Pitter Tool, Heavy Duty Olive Pitter Tool,Cherry Stoner Pitter Core Remover, Portable Cherry Pitter kitchen aid with Space-Saving Lock Design - Black",B07RW2Z72Y,CORE_PIT_REMOVER,R_27NeinuChlzrANs,7.99
2022-12-20,14.95,1.0,MT,"CCVOO 5 Pack Reading Glasses Blue Light Blocking, Filter UV Ray/Glare Computer Readers Fashion Nerd Eyeglasses Women/Men (A6 Mix, 2.0",B0B1VPQL1R,CORRECTIVE_EYEGLASSES,R_2w6Kv77UCoeyLbP,14.95
2022-07-25,22.99,1.0,MT,"BAGSMART Toiletry Bag, Travel Toiletry Organizer with hanging hook, Water-resistant Cosmetic Makeup Bag Travel Organizer for Shampoo, Full Sized Container, Toiletries",B098X82VSL,COSMETIC_CASE,R_2w6Kv77UCoeyLbP,22.99
2021-02-21,25.0,1.0,MT,"Lay-n-Go Cosmo Deluxe Drawstring Cosmetic & Makeup Bag Organizer, Toiletry Bag for Travel, Gifts, and Daily Use, 22 inch, Black",B01DWF3MKY,COSMETIC_CASE,R_2w6Kv77UCoeyLbP,25.0
2022-06-11,6.99,1.0,MT,"UBMSA Makeup Bag,Travel Bag Essentials with Mirror for Women Girls Gifts,Cosmetics Bag Case Storage,Travel Size Toiletries for Brush Jewelry Organizer Accessories (Purple)",B096WV67N6,COSMETIC_CASE,R_1TvhpEMhVBwUasN,6.99
2021-12-12,39.99,1.0,MT,"Gel Nail Polish Starter Kit - 6 Colors Gel Polish Set Base Top Coat, 36W LED UV Nail Lamp with Full DIY Gel Manicure Nail Tools by Vishine 8ml #12",B07DC79J1R,COSMETIC_NAIL_SET,R_2w6Kv77UCoeyLbP,39.99
2022-01-14,5.72,1.0,MT,"Coty Airspun Loose Face Powder, Translucent, Pack of 1",B000BNG4VU,COSMETIC_POWDER,R_2w6Kv77UCoeyLbP,5.72
2022-10-06,9.95,1.0,MT,Mehron Makeup Setting Powder (1 oz) (Neutral),B008ND0RZY,COSMETIC_POWDER,R_3lzv4o9axMfFsE2,9.95
2022-08-05,9.99,1.0,MT,"BEAKEY 5 Pcs Makeup Sponge Set, Foundation Blending Beauty Sponge, Flawless for Liquid, Cream, and Powder, Multi-colored Makeup Sponges",B08TTPKK4H,COSMETIC_SPONGE,R_2w6Kv77UCoeyLbP,9.99
2018-11-12,9.99,1.0,MT,"B-Land Unisex-Adult's Santa Hat, Christmas Hat for Adults Women Men Extra Thicken Xmas Holiday Hat with Comfort Liner",B01J9SRVSM,COSTUME_HEADWEAR,R_DtPfbKjVP7QqLVD,9.99
2022-02-18,14.99,1.0,MT,Masquerade Mask for Women Shiny Rhinestone Venetian Party Prom Ball Metal Mask,B0789HRDWQ,COSTUME_MASK,R_2VJ7KiUFzWY3H0p,14.99
2021-10-02,24.99,1.0,MT,Anime Trainer Costume Adult Kids Hoodie Cosplay Jacket Gloves Hat Sets,B098DN8TSQ,COSTUME_OUTFIT,R_3lzv4o9axMfFsE2,24.99
2021-10-02,24.99,1.0,MT,Anime Trainer Costume Adult Kids Hoodie Cosplay Jacket Gloves Hat Sets,B098DFG7Z8,COSTUME_OUTFIT,R_3lzv4o9axMfFsE2,24.99
2021-11-16,22.99,1.0,MT,Littleforbig Adult Baby Diaper Lover (ABDL) Button Crotch Romper Onesie Pastel Series,B01N90U6Y1,COSTUME_OUTFIT,R_3lzv4o9axMfFsE2,22.99
